"","Full Citation","Source","Year","Author Last Name","Author First Name","Title","Type","`Full Citation` == `Full Citation`"
"1","Adamic, Louis. My America 1928-1938. New York: Harper & Brothers, 1938. ","Sims - True Stories",1938,"Adamic","Louis","My America 1928-1938","Primary Works",TRUE
"2","Ade, George. Chicago Stories. Edited by Franklin J. Meine; illustrated by John T. McCutcheon and others. Chicago: Henry Regnery, 1963. Selected journalism from early in the century.","Sims - True Stories",1963,"Ade","George","Chicago Stories","Primary Works",TRUE
"3","Ade, George. The Old Time Saloon. New York: R. Long & R. R. Smith, 1931. ","Sims - True Stories",1931,"Ade","George","The Old Time Saloon","Primary Works",TRUE
"4","Agee, James. James Agee: Selected Journalism. Edited, with an introduction, by Paul Ashdown. Knoxville: University of Tennessee Press, 1985. ","Sims - True Stories",1985,"Agee","James","James Agee: Selected Journalism","Primary Works",TRUE
"5","Agee, James. Let Us Now Praise Famous Men. Photos by Walker Evans, with an introduction by John Hersey. Boston: Houghton Mifflin, 1988. Originally published in 1941.","Sims - True Stories",1941,"Agee","James","Let Us Now Praise Famous Men","Primary Works",TRUE
"6","Anzaldúa, Gloria. Borderlands/La Frontera: The New Mestiza. San Francisco: Spinsters/Aunt Lute Book Co., 1987.","Sims - True Stories",1987,"Anzaldúa","Gloria","Borderlands/La Frontera: The New Mestiza","Primary Works",TRUE
"7","Arlen, Michael J. Thirty Seconds. New York: Farrar, Straus, Giroux, 1980. ","Sims - True Stories",1980,"Arlen","Michael","Thirty Seconds","Primary Works",TRUE
"8","Baker, Ray Stannard. Following the Color Line. New York: Harper Torchbooks, 1964. Originally published by Doubleday, Page & Co. in 1908.","Sims - True Stories",1908,"Baker","Ray","Following the Color Line","Primary Works",TRUE
"9","Bangs, Lester. Psychotic Reactions and Carburetor Dung. New York: Alfred A. Knopf, 1987.","Sims - True Stories",1987,"Bangs","Lester","Psychotic Reactions and Carburetor Dung","Primary Works",TRUE
"10","Banks, Elizabeth L. Campaigns of Curiosity: Journalistic Adventures of an American Girl in Late Victorian London. Introduction by Mary Suzanne Schriber and Abbey Zink. (Orig. 1894, reprinted by University of Wisconsin Press, 2003.)","Sims - True Stories",2003,"Banks","Elizabeth","Campaigns of Curiosity: Journalistic Adventures of an American Girl in Late Victorian London","Primary Works",TRUE
"11","Barich, Bill. A Fine Place to Daydream: Racehorses, Romance, and the Irish. New York: Alfred A. Knopf, 2005.","Sims - True Stories",2005,"Barich","Bill","A Fine Place to Daydream: Racehorses, Romance, and the Irish","Primary Works",TRUE
"12","Barich, Bill. Laughing in the Hills. New York: Viking Penguin, 1980.","Sims - True Stories",1980,"Barich","Bill","Laughing in the Hills","Primary Works",TRUE
"13","Bedford, Sybille. The Faces of Justice: A Traveller's Report. New York: Simon and Schuster, 1961.","Sims - True Stories",1961,"Bedford","Sybille","The Faces of Justice: A Traveller's Report","Primary Works",TRUE
"14","Berger, Meyer. Meyer Berger’s New York. New York: Random House, 1960.","Sims - True Stories",1960,"Berger","Meyer","Meyer Berger’s New York","Primary Works",TRUE
"15","Berger, Meyer. The Eight Million: Journal of a New York Correspondent. New York: Columbia University Press, 1983. Originally published by Simon and Schuster, 1942.","Sims - True Stories",1942,"Berger","Meyer","The Eight Million: Journal of a New York Correspondent","Primary Works",TRUE
"16","Berkman, Alexander. Prison Memoirs of an Anarchist. Introduction by Hutchins Hapgood; new introduction by Paul Goodman. New York: Schocken Books, 1970. Originally published 1912.","Sims - True Stories",1912,"Berkman","Alexander","Prison Memoirs of an Anarchist","Primary Works",TRUE
"17","Bissinger, H. G. “Buzz.” Friday Night Lights: A Town, a Team, and a Dream. Reading, Mass,: Addison Wesley, 1990.","Sims - True Stories",1990,"Bissinger","H","Buzz","Primary Works",TRUE
"18","Bissinger, H. G. A Prayer for the City. New York: Random House, 1997.  ","Sims - True Stories",1997,"Bissinger","H","G","Primary Works",TRUE
"19","Bissinger, H. G. Three Nights in August: Strategy, Heartbreak, and Joy Inside the Mind of a Manager. Boston and New York: Houghton Mifflin Co., 2005.","Sims - True Stories",2005,"Bissinger","H","G","Primary Works",TRUE
"20","Blais, Madeleine. In These Girls, Hope Is a Muscle. New York: Atlantic Monthly Press, 1995. ","Sims - True Stories",1995,"Blais","Madeleine","In These Girls, Hope Is a Muscle","Primary Works",TRUE
"21","Blais, Madeleine. The Heart Is an Instrument: Portraits in Journalism. Foreword by Geneva Overholser. Amherst: University of Massachusetts Press, 1992.","Sims - True Stories",1992,"Blais","Madeleine","The Heart Is an Instrument: Portraits in Journalism","Primary Works",TRUE
"22","Bolitho, William. Camera Obscura. New York: Simon and Schuster, 1930. ","Sims - True Stories",1930,"Bolitho","William","Camera Obscura","Primary Works",TRUE
"23","Booth, Stanley. The True Adventures of the Rolling Stones. Chicago: A Cappella Books, 2000. Originally published as Dance with the Devil in 1984. Bowden, Mark. Black Hawk Down: A Story of Modern War. New York: Atlantic Monthly Press, 1999.","Sims - True Stories",1999,"Booth","Stanley","The True Adventures of the Rolling Stones","Primary Works",TRUE
"24","Borrow, George. The Bible in Spain. New York: G. P. Putnam's Sons, 1899.","Sims - True Stories",1899,"Borrow","George","The Bible in Spain","Primary Works",TRUE
"25","Borrow, George. The Zincali: An Account of the Gypsies of Spain. London: John Murray, 1923.","Sims - True Stories",1923,"Borrow","George","The Zincali: An Account of the Gypsies of Spain","Primary Works",TRUE
"26","Breslin, Jimmy. A Wolverine Is Eating My Leg. New York: Vintage, 1989.","Sims - True Stories",1989,"Breslin","Jimmy","A Wolverine Is Eating My Leg","Primary Works",TRUE
"27","Breslin, Jimmy. Lost in My Own Backyard: A Walk in Yellowstone National Park. New York: Crown Publishers, 2004.","Sims - True Stories",2004,"Breslin","Jimmy","Lost in My Own Backyard: A Walk in Yellowstone National Park","Primary Works",TRUE
"28","Breslin, Jimmy. The World of Jimmy Breslin. New York: Viking, 1967. ","Sims - True Stories",1967,"Breslin","Jimmy","The World of Jimmy Breslin","Primary Works",TRUE
"29","Bryan, C. D. B. Friendly Fire. New York: G. P. Putnam’s Sons, 1976. ","Sims - True Stories",1976,"Bryan","C","D","Primary Works",TRUE
"30","Buford, Bill. Among the Thugs. New York: W. W. Norton, 1992. ","Sims - True Stories",1992,"Buford","Bill","Among the Thugs","Primary Works",TRUE
"31","Cahan, Abraham. Grandma Never Lived in America: The New Journalism of Abraham Cahan. Edited with an introduction by Moses Rischin. Bloomington: Indiana University Press, 1985.","Sims - True Stories",1985,"Cahan","Abraham","Grandma Never Lived in America: The New Journalism of Abraham Cahan","Primary Works",TRUE
"32","Cahill, Tim. Jaguars Ripped My Flesh: Adventure Is A Risky Business. Toronto: New York, Bantam Books, 1987.","Sims - True Stories",1987,"Cahill","Tim","Jaguars Ripped My Flesh: Adventure Is A Risky Business","Primary Works",TRUE
"33","Caldwell, Erskine, and Margaret Bourke-White. You Have Seen Their Faces. New York: Modern Age Books, 1937.","Sims - True Stories",1937,"Caldwell","Erskine","You Have Seen Their Faces","Primary Works",TRUE
"34","Capote, Truman. In Cold Blood. New York: Random House, 1965.","Sims - True Stories",1965,"Capote","Truman","In Cold Blood","Primary Works",TRUE
"35","Capote, Truman. The Muses Are Heard. New York: Random House, 1956. ","Sims - True Stories",1956,"Capote","Truman","The Muses Are Heard","Primary Works",TRUE
"36","Carr, Cynthia. On Edge: Performance at the End of the Twentieth Century. Hanover, N.H.: University Press of New England, 1993.","Sims - True Stories",1993,"Carr","Cynthia","On Edge: Performance at the End of the Twentieth Century","Primary Works",TRUE
"37","Conaway, James. Napa: The Story of an American Eden. Boston and New York: Houghton Mifflin, 1990.","Sims - True Stories",1990,"Conaway","James","Napa: The Story of an American Eden","Primary Works",TRUE
"38","Conaway, James. The Texans. New York: Alfred A. Knopf, 1976.","Sims - True Stories",1976,"Conaway","James","The Texans","Primary Works",TRUE
"39","Conover, Ted. Coyotes: A Journey through the Secret World of America's Illegal Aliens. New York: Vintage Books, 1987.","Sims - True Stories",1987,"Conover","Ted","Coyotes: A Journey through the Secret World of America's Illegal Aliens","Primary Works",TRUE
"40","Conover, Ted. NewJack: Guarding Sing Sing. New York: Random House, 2000. ","Sims - True Stories",2000,"Conover","Ted","NewJack: Guarding Sing Sing","Primary Works",TRUE
"41","Conover, Ted. Rolling Nowhere: Riding the Rails with America’s Hoboes. New York: Viking, 1984.","Sims - True Stories",1984,"Conover","Ted","Rolling Nowhere: Riding the Rails with America’s Hoboes","Primary Works",TRUE
"42","Conover, Ted. Whiteout: Lost In Aspen. New York: Random House, 1991.","Sims - True Stories",1991,"Conover","Ted","Whiteout: Lost In Aspen","Primary Works",TRUE
"43","Cramer, Richard Ben. Joe DiMaggio: The Hero's Life. New York: Simon & Schuster, 2000.","Sims - True Stories",2000,"Cramer","Richard","Joe DiMaggio: The Hero's Life","Primary Works",TRUE
"44","Crane, Stephen. Tales, Sketches, and Reports, Vol. 7 of The Works of Stephen Crane, edited by Fredson Bowers. Charlottesville: University Press of Virginia, 1973.","Sims - True Stories",1973,"Crane","Stephen","Tales, Sketches, and Reports, Vol","Primary Works",TRUE
"45","Dash, Leon. Rosa Lee: A Mother and Her Family in Urban America. New York: Basic Books, 1996.","Sims - True Stories",1996,"Dash","Leon","Rosa Lee: A Mother and Her Family in Urban America","Primary Works",TRUE
"46","Davidson, Sara. Loose Change: Three Women of the Sixties. Garden City, N.Y.: Doubleday, 1977.","Sims - True Stories",1977,"Davidson","Sara","Loose Change: Three Women of the Sixties","Primary Works",TRUE
"47","Davidson, Sara. Real Property. Garden City, N.Y.: Doubleday & Co., 1980.","Sims - True Stories",1980,"Davidson","Sara","Real Property","Primary Works",TRUE
"48","Davis, Richard Harding. A Year from a Reporter's Note-Book. New York: Harper & Brothers, 1897. ","Sims - True Stories",1897,"Davis","Richard","A Year from a Reporter's Note-Book","Primary Works",TRUE
"49","Davis, Richard Harding. The Red Cross Girl. New York: Charles Scribner's Sons, 1916.","Sims - True Stories",1916,"Davis","Richard","The Red Cross Girl","Primary Works",TRUE
"50","Didion, Joan. Miami. New York: Simon and Schuster, 1987.","Sims - True Stories",1987,"Didion","Joan","Miami","Primary Works",TRUE
"51","Didion, Joan. Salvador. New York: Simon and Schuster, 1983.","Sims - True Stories",1983,"Didion","Joan","Salvador","Primary Works",TRUE
"52","Didion, Joan. Slouching Towards Bethlehem. New York: Farrar, Straus & Giroux, 1968. ","Sims - True Stories",1968,"Didion","Joan","Slouching Towards Bethlehem","Primary Works",TRUE
"53","Didion, Joan. The White Album. New York: Simon and Schuster, 1979.","Sims - True Stories",1979,"Didion","Joan","The White Album","Primary Works",TRUE
"54","Dorr, Rheta Childe. Inside the Russian Revolution. New York: Macmillan Co., 1918. Reprinted by Arno Press in 1970.","Sims - True Stories",1970,"Dorr","Rheta","Inside the Russian Revolution","Primary Works",TRUE
"55","Dos Passos, John. In All Countries. New York: Harcourt, Brace and Co., 1934. ","Sims - True Stories",1934,"Dos Passos","John","In All Countries","Primary Works",TRUE
"56","Dos Passos, John. Orient Express. New York: Harper & Brothers, 1922, 1927.","Sims - True Stories",1927,"Dos Passos","John","Orient Express","Primary Works",TRUE
"57","Dos Passos, John. Rosinante to the Road Again. New York: George H. Doran Co., 1922. ","Sims - True Stories",1922,"Dos Passos","John","Rosinante to the Road Again","Primary Works",TRUE
"58","Dos Passos, John. Theodore Dreiser: A Selection of Uncollected Prose. Detroit: Wayne State University Press, 1977.","Sims - True Stories",1977,"Dos Passos","John","Theodore Dreiser: A Selection of Uncollected Prose","Primary Works",TRUE
"59","Dreiser, Theodore. Selected Magazine Articles of Theodore Dreiser: Life and Art in the American 1890s. Edited, with an introduction and notes, by Yoshinobu Hakutani. Rutherford, Madison, Teaneck: Fairleigh Dickinson University Press, 1985.","Sims - True Stories",1985,"Dreiser","Theodore","Selected Magazine Articles of Theodore Dreiser: Life and Art in the American 1890s","Primary Works",TRUE
"60","Dreiser, Theodore. The Color of a Great City. New York: Boni and Liveright, 1923.","Sims - True Stories",1923,"Dreiser","Theodore","The Color of a Great City","Primary Works",TRUE
"61","Du Bois, W. E. B. The Souls of Black Folk, edited by Saunders Redding. New York: Fawcett, 1961. Originally published in 1903.","Sims - True Stories",1903,"Du Bois","W","E","Primary Works",TRUE
"62","Du Bois, W. E. B. W E. B. DuBois: Writings, edited by Nathan Huggins. New York: The Library of America, 1986.","Sims - True Stories",1986,"Du Bois","W","E","Primary Works",TRUE
"63","Dunne, Finley Peter. Mr. Dooley at His Best. Edited by Elmer Ellis. New York: Scribner's, 1943.","Sims - True Stories",1943,"Dunne","Finley","Mr","Primary Works",TRUE
"64","Dunne, John Gregory. Vegas: A Memoir of a Dark Season. New York: Random House, 1974.","Sims - True Stories",1974,"Dunne","John","Vegas: A Memoir of a Dark Season","Primary Works",TRUE
"65","Durland, Kellogg. The Red Reign: The True Story of an Adventurous Year in Russia. New York: The Century Co., 1907.","Sims - True Stories",1907,"Durland","Kellogg","The Red Reign: The True Story of an Adventurous Year in Russia","Primary Works",TRUE
"66","Ehrenreich, Barbara. Nickel and Dimed: On (Not) Getting By in America. New York: Henry Holt and Co., 2001.","Sims - True Stories",2001,"Ehrenreich","Barbara","Nickel and Dimed: On (Not) Getting By in America","Primary Works",TRUE
"67","Ehrlich, Gretel. The Solace of Open Spaces. New York: Viking, 1985.","Sims - True Stories",1985,"Ehrlich","Gretel","The Solace of Open Spaces","Primary Works",TRUE
"68","Fadiman, Anne. The Spirit Catches You and You Fall Down: A Hmong Child, Her American Doctors, and the Collision of Two Cultures. New York: Farrar, Straus and Giroux, 1997.","Sims - True Stories",1997,"Fadiman","Anne","The Spirit Catches You and You Fall Down: A Hmong Child, Her American Doctors, and the Collision of Two Cultures","Primary Works",TRUE
"69","Finerty, John F. War-Path and Bivouac or The Conquest of the Sioux. Norman and London: University of Oklahoma Press, 1994; originally published 1890.","Sims - True Stories",1890,"Finerty","John","War-Path and Bivouac or The Conquest of the Sioux","Primary Works",TRUE
"70","Finnegan, William. Dateline Soweto: Travels With Black South African Reporters. New York: HarperCollins, 1988.","Sims - True Stories",1988,"Finnegan","William","Dateline Soweto: Travels With Black South African Reporters","Primary Works",TRUE
"71","Fitzgerald, Frances. Cities on a Hill: A Journey through Contemporary American Cultures. New York: Simon and Schuster, 1986.","Sims - True Stories",1986,"Fitzgerald","Frances","Cities on a Hill: A Journey through Contemporary American Cultures","Primary Works",TRUE
"72","Flanner, Janet. A Moveable Feast. New York: Scribner's, 1964.","Sims - True Stories",1964,"Flanner","Janet","A Moveable Feast","Primary Works",TRUE
"73","Flanner, Janet. Dateline: Toronto; The Complete Toronto Star Dispatches, 1920-1924. Edited by William White. New York: Charles Scribner's Sons,1985.","Sims - True Stories",1985,"Flanner","Janet","Dateline: Toronto; The Complete Toronto Star Dispatches, 1920-1924","Primary Works",TRUE
"74","Flanner, Janet. Death in the Afternoon. New York: Scribner's, 1932.","Sims - True Stories",1932,"Flanner","Janet","Death in the Afternoon","Primary Works",TRUE
"75","Flanner, Janet. Green Hills of Africa. New York: Scribner's, 1935.","Sims - True Stories",1935,"Flanner","Janet","Green Hills of Africa","Primary Works",TRUE
"76","Flanner, Janet. Paris Was Yesterday (1925-1939). New York: Popular Library, 1972. ","Sims - True Stories",1972,"Flanner","Janet","Paris Was Yesterday (1925-1939)","Primary Works",TRUE
"77","Flanner, Janet. The Dangerous Summer. New York: Scribner's, 1985. Originally published 1960.","Sims - True Stories",1960,"Flanner","Janet","The Dangerous Summer","Primary Works",TRUE
"78","Flanner, Janet. The Trouble I’ve Seen. New York: William Morrow and Co., 1936. ","Sims - True Stories",1936,"Flanner","Janet","The Trouble I’ve Seen","Primary Works",TRUE
"79","Flanner, Janet.(Genêt) Paris Journal 1944-1965. Edited by William Shawn. New York: Atheneum, 1965.","Sims - True Stories",1965,"Flanner","Janet","Edited by William Shawn","Primary Works",TRUE
"80","Flynt, Josiah. Tramping with Tramps: Studies and Sketches of Vagabond Life. New York: The Century Co., 1899.","Sims - True Stories",1899,"Flynt","Josiah","Tramping with Tramps: Studies and Sketches of Vagabond Life","Primary Works",TRUE
"81","Frady, Marshall. Southerners: A Journalist's Odyssey. New York: New American Library, 1980.","Sims - True Stories",1980,"Frady","Marshall","Southerners: A Journalist's Odyssey","Primary Works",TRUE
"82","Franklin, Jon. “Mrs. Kelly’s Monster,” in Writing for Story: Craft Secrets of Dramatic Nonfiction by a Two-Time Pulitzer Prize Winner. New York: Atheneum, 1986; originally published in the Baltimore Evening Sun, 1978. ——. Shocktrauma. New York: St. Martin's Press, 1980.","Sims - True Stories",1980,"Franklin","Jon","Mrs. Kelly’s Monster","Primary Works",TRUE
"83","Frazer, Ian. Great Plains. New York: Farrar, Straus & Giroux, 1989.","Sims - True Stories",1989,"Frazer","Ian","Great Plains","Primary Works",TRUE
"84","Frazer, Ian. On the Rez. New York: Farrar, Straus, Giroux, 2000.","Sims - True Stories",2000,"Frazer","Ian","On the Rez","Primary Works",TRUE
"85","Frey, Darcy. The Last Shot: City Streets, Basketball Dreams. Boston: Houghton Mifflin, 1994.","Sims - True Stories",1994,"Frey","Darcy","The Last Shot: City Streets, Basketball Dreams","Primary Works",TRUE
"86","Gellhorn, Martha. “The Third Winter” in The Face of War. New York: Atlantic Monthly Press, 1988.","Sims - True Stories",1988,"Gellhorn","Martha","Gellhorn, Martha. “The Third Winter” in The Face of War. New York: Atlantic Monthly Press, 1988.","Primary Works",TRUE
"87","Goldstein, Richard. Reporting the Counterculture. Boston: Unwin Hyman, 1989. ","Sims - True Stories",1989,"Goldstein","Richard","Reporting the Counterculture","Primary Works",TRUE
"88","Gorney, Cynthia. Articles Of Faith: A Frontline History of the Abortion Wars. New York: Simon & Schuster, 1998.","Sims - True Stories",1998,"Gorney","Cynthia","Articles Of Faith: A Frontline History of the Abortion Wars","Primary Works",TRUE
"89","Gray, Francine du Plessix. Adam & Eve and the City: Selected Nonfiction. New York: Simon and Schuster, 1987.","Sims - True Stories",1987,"Gray","Francine","Adam & Eve and the City: Selected Nonfiction","Primary Works",TRUE
"90","Greene, Melissa Fay. Praying for Sheetrock: A Work of Nonfiction. Reading, Mass.: Addison-Wesley Publishing, 1991.","Sims - True Stories",1991,"Greene","Melissa","Praying for Sheetrock: A Work of Nonfiction","Primary Works",TRUE
"91","Halberstam, David. The Amateurs. New York: William Morrow and Co., 1985. ","Sims - True Stories",1985,"Halberstam","David","The Amateurs","Primary Works",TRUE
"92","Halberstam, David. The Breaks of the Game. New York: Alfred A. Knopf, 1981.","Sims - True Stories",1981,"Halberstam","David","The Breaks of the Game","Primary Works",TRUE
"93","Halberstam, David. The Making of a Quagmire. New York: Random House, 1965. ","Sims - True Stories",1965,"Halberstam","David","The Making of a Quagmire","Primary Works",TRUE
"94","Hamburger, Robert. All the Lonely People: Life in a Single Room Occupancy Hotel. New Haven and New York: Ticknor & Fields, 1983.","Sims - True Stories",1983,"Hamburger","Robert","All the Lonely People: Life in a Single Room Occupancy Hotel","Primary Works",TRUE
"95","Hamill, Pete. The Invisible City: A New York Sketchbook. Drawings by Susan Stillman. New York: Random House, 1980.","Sims - True Stories",1980,"Hamill","Pete","The Invisible City: A New York Sketchbook","Primary Works",TRUE
"96","Hapgood, Hutchins. An Anarchist Woman. New York: Duffield & Co., 1909. ——. The Spirit of the Ghetto: Studies of the Jewish Quarter in New York. Introduction by Moses Rischin. Cambridge: Harvard University Press, 1967. Originally published in 1902.","Sims - True Stories",1902,"Hapgood","Hutchins","An Anarchist Woman","Primary Works",TRUE
"97","Hapgood, Hutchins. The Spirit of Labor. New York: Duffield & Co., 1907.","Sims - True Stories",1907,"Hapgood","Hutchins","The Spirit of Labor","Primary Works",TRUE
"98","Hapgood, Hutchins. Types from City Streets. New York and London: Funk & Wagnalls Co., 1910. Magazine articles and sketches.","Sims - True Stories",1910,"Hapgood","Hutchins","Types from City Streets","Primary Works",TRUE
"99","Harr, Jonathan. A Civil Action. New York: Random House, 1995.","Sims - True Stories",1995,"Harr","Jonathan","A Civil Action","Primary Works",TRUE
"100","Harr, Jonathan. The Lost Painting: The Quest for a Caravaggio Masterpiece. New York: Random House, 2005.","Sims - True Stories",2005,"Harr","Jonathan","The Lost Painting: The Quest for a Caravaggio Masterpiece","Primary Works",TRUE
"101","Harrington, Walt. At the Heart of It: Ordinary People, Extraordinary Lives. Columbia: University of Missouri Press, 1996.","Sims - True Stories",1996,"Harrington","Walt","At the Heart of It: Ordinary People, Extraordinary Lives","Primary Works",TRUE
"102","Harrington, Walt. Crossings: A White Man's Journey into Black America. New York: HarperCollins, 1993.","Sims - True Stories",1993,"Harrington","Walt","Crossings: A White Man's Journey into Black America","Primary Works",TRUE
"103","Hayes, David. No Easy Answers: The Trial and Conviction of Bruce Curtis. New York: Viking, 1986.","Sims - True Stories",1986,"Hayes","David","No Easy Answers: The Trial and Conviction of Bruce Curtis","Primary Works",TRUE
"104","Hayes, David. Power and Influence: The Globe and Mail and the News Revolution. Toronto: Key Porter Books, 1992.","Sims - True Stories",1992,"Hayes","David","Power and Influence: The Globe and Mail and the News Revolution","Primary Works",TRUE
"105","Hearn, Lafcadio. Creole Sketches. Edited by Charles Woodward Hutson. Bostonand New York: Houghton Mifflin, 1924.","Sims - True Stories",1924,"Hearn","Lafcadio","Creole Sketches","Primary Works",TRUE
"106","Hearn, Lafcadio. Fantastics and Other Fancies. Boston and New York: Houghton Mifflin,1914. New Orleans newspaper articles, 1879-1884.","Sims - True Stories",1884,"Hearn","Lafcadio","Fantastics and Other Fancies","Primary Works",TRUE
"107","Hecht, Ben. 1001 Afternoons in Chicago. Chicago: Pascal Covici, 1922. ","Sims - True Stories",1922,"Hecht","Ben","Chicago: Pascal Covici, 1922","Primary Works",TRUE
"108","Hemingway, Ernest. By-Line: Ernest Hemingway. Edited by William White. New York: Scribner's, 1967.","Sims - True Stories",1967,"Hemingway","Ernest","By-Line: Ernest Hemingway","Primary Works",TRUE
"109","Herr, Michael. Dispatches. New York: Alfred A. Knopf, 1977. ","Sims - True Stories",1977,"Herr","Michael","Dispatches","Primary Works",TRUE
"110","Hersey, John. Here to Stay. New York: Alfred A. Knopf, 1963. Collected stories from World War II.","Sims - True Stories",1963,"Hersey","John","Here to Stay","Primary Works",TRUE
"111","Hersey, John. Hiroshima. New York: Alfred A. Knopf, 1946.","Sims - True Stories",1946,"Hersey","John","Hiroshima","Primary Works",TRUE
"112","Hoagland, Edward. The Edward Hoagland Reader. Edited and with an introduction by Geoffrey Wolff. New York: Random House, 1979. Hubbell, Sue. A Book of Bees. New York: Random House, 1988.","Sims - True Stories",1988,"Hoagland","Edward","The Edward Hoagland Reader","Primary Works",TRUE
"113","Junger, Sebastian. A Death in Belmont. New York: W.W. Norton, 2006. ","Sims - True Stories",2006,"Junger","Sebastian","A Death in Belmont","Primary Works",TRUE
"114","Junger, Sebastian. The Perfect Storm: A True Story of Men Against the Sea. W.W. Norton, 1997. ","Sims - True Stories",1997,"Junger","Sebastian","The Perfect Storm: A True Story of Men Against the Sea","Primary Works",TRUE
"115","Kapuściński, Ryszard. Another Day of Life. New York: Harcourt Brace Jovanovich, 1987; Vintage International Edition, 2001.","Sims - True Stories",2001,"Kapuściński","Ryszard","Another Day of Life","Primary Works",TRUE
"116","Kapuściński, Ryszard. The Shadow of the Sun. Translated from the Polish by Klara Glowczewska. New York and Toronto: Alfred A. Knopf, 2001.","Sims - True Stories",2001,"Kapuściński","Ryszard","The Shadow of the Sun","Primary Works",TRUE
"117","Kidder, Tracy. Among Schoolchildren. Boston: Houghton Mifflin, 1989. ","Sims - True Stories",1989,"Kidder","Tracy","Among Schoolchildren","Primary Works",TRUE
"118","Kidder, Tracy. Home Town. New York: Random House, 1999.","Sims - True Stories",1999,"Kidder","Tracy","Home Town","Primary Works",TRUE
"119","Kidder, Tracy. House. Boston: Houghton Mifflin, 1985.","Sims - True Stories",1985,"Kidder","Tracy","House","Primary Works",TRUE
"120","Kidder, Tracy. Mountains Beyond Mountains. New York: Random House, 2003.","Sims - True Stories",2003,"Kidder","Tracy","Mountains Beyond Mountains","Primary Works",TRUE
"121","Kidder, Tracy. Old Friends. Boston: Houghton Mifflin, 1993.","Sims - True Stories",1993,"Kidder","Tracy","Old Friends","Primary Works",TRUE
"122","Kidder, Tracy. The Soul of a New Machine. Boston: Little, Brown and Co., 1981. ","Sims - True Stories",1981,"Kidder","Tracy","The Soul of a New Machine","Primary Works",TRUE
