"","Full Citation","Source","Year","Author Last Name","Author First Name","Title","Type","`Full Citation` == `Full Citation`"
"123","Klinkenborg, Verlyn. Making Hay. New York: Lyons Books,1986.","Sims - True Stories",1986,"Klinkenborg","Verlyn","Making Hay","Primary Works",TRUE
"124","Klinkenborg, Verlyn. The Last Fine Time. New York: Alfred A. Knopf, 1991. ","Sims - True Stories",1991,"Klinkenborg","Verlyn","The Last Fine Time","Primary Works",TRUE
"125","Krakauer, Jon. Into Thin Air: A Personal Account of the Mt. Everest Disaster. New York: Villard,1997.","Sims - True Stories",1997,"Krakauer","Jon","Into Thin Air: A Personal Account of the Mt","Primary Works",TRUE
"126","Krakauer, Jon. Under the Banner of Heaven: A Story of Violent Faith. New York: Doubleday, 2003.","Sims - True Stories",2003,"Krakauer","Jon","Under the Banner of Heaven: A Story of Violent Faith","Primary Works",TRUE
"127","Kramer, Jane. Europeans. New York: Farrar, Straus & Giroux, 1988.","Sims - True Stories",1988,"Kramer","Jane","Europeans","Primary Works",TRUE
"128","Kramer, Jane. Lone Patriot: The Short Career of an American Militiaman. New York: Pantheon, 2002.","Sims - True Stories",2002,"Kramer","Jane","Lone Patriot: The Short Career of an American Militiaman","Primary Works",TRUE
"129","Kramer, Jane. The Last Cowboy. New York: Harper & Row, 1977.","Sims - True Stories",1977,"Kramer","Jane","The Last Cowboy","Primary Works",TRUE
"130","Kramer, Jane. Unsettling Europe. New York: Random House, 1980.","Sims - True Stories",1980,"Kramer","Jane","Unsettling Europe","Primary Works",TRUE
"131","Kramer, Mark. Invasive Procedures: A Year in the World of Two Surgeons. New York: Harper & Row, 1983.","Sims - True Stories",1983,"Kramer","Mark","Invasive Procedures: A Year in the World of Two Surgeons","Primary Works",TRUE
"132","Kramer, Mark. Three Farms: Making Milk, Meat and Money from the American Soil. Boston: Little, Brown and Co., 1980.","Sims - True Stories",1980,"Kramer","Mark","Three Farms: Making Milk, Meat and Money from the American Soil","Primary Works",TRUE
"133","Kramer, Mark. Travels with a Hungry Bear: A Journey to the Russian Heartland. Boston and New York: Houghton Mifflin, 1996.","Sims - True Stories",1996,"Kramer","Mark","Travels with a Hungry Bear: A Journey to the Russian Heartland","Primary Works",TRUE
"134","Lange, Dorothea and Paul S. Taylor. An American Exodus: A Record of Human Erosion. New York: Reynal & Hitchcock, 1939.","Sims - True Stories",1939,"Lange","Dorothea","Taylor","Primary Works",TRUE
"135","Langewiesche, William. American Ground: Unbuilding the World Trade Center. New York: North Point Press, 2002.","Sims - True Stories",2002,"Langewiesche","William","American Ground: Unbuilding the World Trade Center","Primary Works",TRUE
"136","LeBlanc, Adrian Nicole. Random Family: Love, Drugs, Trouble, and Coming of Age in the Bronx. New York: Scribner, 2003.","Sims - True Stories",2003,"LeBlanc","Adrian","Random Family: Love, Drugs, Trouble, and Coming of Age in the Bronx","Primary Works",TRUE
"137","Lernoux, Penny. Cry of the People. Garden City, N.Y.: Doubleday, 1982. ","Sims - True Stories",1982,"Lernoux","Penny","Cry of the People","Primary Works",TRUE
"138","Levine, Richard M. Bad Blood: A Family Murder in Marin County. New York: Random House, 1982.","Sims - True Stories",1982,"Levine","Richard","Bad Blood: A Family Murder in Marin County","Primary Works",TRUE
"139","Lewis, Michael. Liar's Poker: Rising Through the Wreckage on Wall Street. New York: W. W. Norton & Co., 1989.","Sims - True Stories",1989,"Lewis","Michael","Liar's Poker: Rising Through the Wreckage on Wall Street","Primary Works",TRUE
"140","Lewis, Michael. Moneyball: The Art of Winning an Unfair Game. New York: W. W. Norton & Co., 2003.","Sims - True Stories",2003,"Lewis","Michael","Moneyball: The Art of Winning an Unfair Game","Primary Works",TRUE
"141","Lewis, Michael. The New New Thing: A Silicon Valley Story. New York: W. W. Norton & Co., 1999.","Sims - True Stories",1999,"Lewis","Michael","The New New Thing: A Silicon Valley Story","Primary Works",TRUE
"142","Liebling, A. J. Back Where I Came From. New York: Sheridan House, 1938. ","Sims - True Stories",1938,"Liebling","A","J","Primary Works",TRUE
"143","Liebling, A. J. Just Enough Liebling: Classic Work by the Legendary New Yorker Writer. Introduction by David Remnick. New York: North Point Press, 2004. ","Sims - True Stories",2004,"Liebling","A","J","Primary Works",TRUE
"144","Liebling, A. J. Liebling Abroad. Introduction by Raymond Sokolov. Playboy Press, 1981. Contains: The Road Back to Paris, Mollie & Other War Pieces, Normandy Revisited, Between Meals: An Appetite for Paris.","Sims - True Stories",1981,"Liebling","A","J","Primary Works",TRUE
"145","Liebling, A. J. Liebling at Home. Introduction by Herbert Mitgang. Wideview Books, 1982. Contains: The Telephone Booth Indian; Chicago: The Second City; The Honest Rainmaker; The Earl of Louisiana; and The Jolity Building. ——. The Sweet Science. New York: Viking, 1956.","Sims - True Stories",1956,"Liebling","A","J","Primary Works",TRUE
"146","London, Jack. Insurgent Mexico. New York: International Publishers, 1969. First published 1914.","Sims - True Stories",1914,"London","Jack","Insurgent Mexico","Primary Works",TRUE
"147","London, Jack. Jack London on the Road: The Tramp Diary and Other Hobo Writings. Edited by Richard W. Etulain. Logan, Utah: Utah State University Press, 1979.","Sims - True Stories",1979,"London","Jack","Jack London on the Road: The Tramp Diary and Other Hobo Writings","Primary Works",TRUE
"148","London, Jack. The Education of John Reed. With an introductory essay by John Stuart. New York: International Publishers, 1955.","Sims - True Stories",1955,"London","Jack","The Education of John Reed","Primary Works",TRUE
"149","London, Jack. The People of the Abyss. New York: Grosset & Dunlap, 1903.","Sims - True Stories",1903,"London","Jack","The People of the Abyss","Primary Works",TRUE
"150","London, Jack. The Road. New York: The Macmillan Co., 1907. Reed, John. Adventures of a Young Man: Short Stories from Life. San Francisco: City Lights Books, 1975.","Sims - True Stories",1975,"London","Jack","The Road","Primary Works",TRUE
"151","Lopez, Barry. Arctic Dreams: Imagination and Desire in a Northern Landscape. New York: Charles Scribner's Sons, 1986.","Sims - True Stories",1986,"Lopez","Barry","Arctic Dreams: Imagination and Desire in a Northern Landscape","Primary Works",TRUE
"152","Lukas, J. Anthony. Common Ground: A Turbulent Decade in the Lives of Three American Families. New York: Alfred A. Knopf, 1985.","Sims - True Stories",1985,"Lukas","J","Anthony","Primary Works",TRUE
"153","Maclean, Norman. Young Men and Fire. Chicago: University Of Chicago Press, 1992.","Sims - True Stories",1992,"Maclean","Norman","Young Men and Fire","Primary Works",TRUE
"154","Mahoney, Rosemary. Whoredom in Kimmage: Irish Women Coming of Age. Boston: Houghton Mifflin,1993.","Sims - True Stories",1993,"Mahoney","Rosemary","Whoredom in Kimmage: Irish Women Coming of Age","Primary Works",TRUE
"155","Mailer, Norman. Some Honorable Men: Political Conventions 1960-1972. Boston: Little, Brown & Co., 1976. Contains “Superman Comes to the Supermarket.” ","Sims - True Stories",1976,"Mailer","Norman","Superman Comes to the Supermarket","Primary Works",TRUE
"156","Mailer, Norman. The Armies of the Night: History as a Novel; The Novel as History. New York: New American Library, 1968.","Sims - True Stories",1968,"Mailer","Norman","The Armies of the Night: History as a Novel; The Novel as History","Primary Works",TRUE
"157","Mailer, Norman. The Executioner's Song. Boston: Little, Brown & Co., 1979.","Sims - True Stories",1979,"Mailer","Norman","The Executioner's Song","Primary Works",TRUE
"158","Marcus, David L. What It Takes to Pull Me Through. Boston and New York: Houghton Mifflin Co., 2005.","Sims - True Stories",2005,"Marcus","David","What It Takes to Pull Me Through","Primary Works",TRUE
"159","Márquez, Gabriel García. The Story of a Shipwrecked Sailor. New York: Alfred A. Knopf, 1986.","Sims - True Stories",1986,"Márquez","Gabriel","The Story of a Shipwrecked Sailor","Primary Works",TRUE
"160","Matthews, Anne. Wild Nights: Nature Returns to the City. New York: North Point Press, 2001.","Sims - True Stories",2001,"Matthews","Anne","Wild Nights: Nature Returns to the City","Primary Works",TRUE
"161","Matthiessen, Peter. Hanoi. London: Weidenfeld and Nicholson, 1968.","Sims - True Stories",1968,"Matthiessen","Peter","Hanoi","Primary Works",TRUE
"162","Matthiessen, Peter. The Snow Leopard. New York: Viking, 1978. McCarthy, Mary. Vietnam. New York: Harcourt, Brace & World, 1967. ","Sims - True Stories",1967,"Matthiessen","Peter","The Snow Leopard","Primary Works",TRUE
"163","McCarthy, Mary. On the Contrary. New York: Farrar, Straus and Cudahy, 1961. McKelway, St. Clair. True Tales from the Annals of Crime and Rascality. New York: Random House, 1951.","Sims - True Stories",1951,"McCarthy","Mary","On the Contrary","Primary Works",TRUE
"164","McGinniss, Joe. The Selling of the President 1968. New York: Trident Press, 1969.","Sims - True Stories",1969,"McGinniss","Joe","The Selling of the President 1968","Primary Works",TRUE
"165","McKelway, St. Clair. The Big Little Man from Brooklyn. Boston: Houghton Mifflin Co., 1969","Sims - True Stories",1969,"McKelway","St","Clair","Primary Works",TRUE
"166","McKelway, St. Clair. The Edinburgh Caper; A One-Man International Plot. New York: Holt, Rinehart and Winston, 1962.","Sims - True Stories",1962,"McKelway","St","Clair","Primary Works",TRUE
"167","McNulty, John. A Man Gets Around. Boston: Little, Brown and Co., 1951. ","Sims - True Stories",1951,"McNulty","John","A Man Gets Around","Primary Works",TRUE
"168","McNulty, John. The World of John McNulty. With an appreciation by James Thurber. Garden City, N.Y.: Doubleday & Co., 1957","Sims - True Stories",1957,"McNulty","John","The World of John McNulty","Primary Works",TRUE
"169","McNulty, John. Third Avenue, New York. Boston: Little, Brown and Co., 1946.","Sims - True Stories",1946,"McNulty","John","Third Avenue, New York","Primary Works",TRUE
"170","McPhee, John. Annals of the Former World. New York: Farrar, Straus & Giroux, 1998.","Sims - True Stories",1998,"McPhee","John","Annals of the Former World","Primary Works",TRUE
"171","McPhee, John. Coming Into the Country. New York: Farrar, Straus & Giroux, 1977.","Sims - True Stories",1977,"McPhee","John","Coming Into the Country","Primary Works",TRUE
"172","McPhee, John. Encounters with the Archdruid. New York: Farrar, Straus, & Giroux, 1971. ","Sims - True Stories",1971,"McPhee","John","Encounters with the Archdruid","Primary Works",TRUE
"173","McPhee, John. Oranges. New York: Farrar, Straus & Giroux, 1966.","Sims - True Stories",1966,"McPhee","John","Oranges","Primary Works",TRUE
"174","McPhee, John. The Control of Nature. New York: Farrar, Straus & Giroux, 1989.","Sims - True Stories",1989,"McPhee","John","The Control of Nature","Primary Works",TRUE
"175","McPhee, John. The John McPhee Reader. Edited, with an introduction, by William Howarth. New York: Farrar, Straus, & Giroux, 1976.","Sims - True Stories",1976,"McPhee","John","The John McPhee Reader","Primary Works",TRUE
"176","McPhee, John. Uncommon Carriers. New York: Farrar, Straus & Giroux, 2006.","Sims - True Stories",2006,"McPhee","John","Uncommon Carriers","Primary Works",TRUE
"177","Mitchell, Joseph. ""The Mohawks in High Steel,"" in Apologies to the Iroquois, with Edmund Wilson. New York: Farrar, Straus, 1960.","Sims - True Stories",1960,"Mitchell","Joseph","Mitchell, Joseph. ""The Mohawks in High Steel,"" in Apologies to the Iroquois, with Edmund Wilson. New York: Farrar, Straus, 1960.","Primary Works",TRUE
"178","Mitchell, Joseph. Joe Gould's Secret. New York: Viking, 1965.","Sims - True Stories",1965,"Mitchell","Joseph","Joe Gould's Secret","Primary Works",TRUE
"179","Mitchell, Joseph. McSorley's Wonderful Saloon. New York: Duell, Sloan and Pearce, 1943. ","Sims - True Stories",1943,"Mitchell","Joseph","McSorley's Wonderful Saloon","Primary Works",TRUE
"180","Mitchell, Joseph. My Ears Are Bent. New York: Sheridan House, 1938; reprinted by Pantheon Books, 2001.","Sims - True Stories",2001,"Mitchell","Joseph","My Ears Are Bent","Primary Works",TRUE
"181","Mitchell, Joseph. My Ears Are Bent. New York: Sheridan House, 1938.","Sims - True Stories",1938,"Mitchell","Joseph","My Ears Are Bent","Primary Works",TRUE
"182","Mitchell, Joseph. The Bottom of the Harbor. Boston: Little, Brown and Company, 1960.","Sims - True Stories",1960,"Mitchell","Joseph","The Bottom of the Harbor","Primary Works",TRUE
"183","Mitchell, Joseph. Up in the Old Hotel. New York: Pantheon Books, 1992.","Sims - True Stories",1992,"Mitchell","Joseph","Up in the Old Hotel","Primary Works",TRUE
"184","Mitchell, Joseph. Up in the Old Hotel. New York: Random House, 1992.","Sims - True Stories",1992,"Mitchell","Joseph","Up in the Old Hotel","Primary Works",TRUE
"185","Morgan, Dan. Merchants of Grain. New York: Viking, 1979.","Sims - True Stories",1979,"Morgan","Dan","Merchants of Grain","Primary Works",TRUE
"186","Naipaul, Shiva. Journey to Nowhere: A New World Tragedy. New York: Simon and Schuster, 1981; first published in Great Britain as Black and White, 1980.","Sims - True Stories",1980,"Naipaul","Shiva","Journey to Nowhere: A New World Tragedy","Primary Works",TRUE
"187","Naipaul, V. S. A Turn in the South. New York: Alfred A. Knopf, 1989.","Sims - True Stories",1989,"Naipaul","V","S","Primary Works",TRUE
"188","Olsen, Tillie. Silences. New York: Delta/Seymour Lawrence, 1989. Originally published in 1978.","Sims - True Stories",1978,"Olsen","Tillie","Silences","Primary Works",TRUE
"189","Orlean, Susan. The Bullfighter Checks Her Makeup: My Encounters with Extraordinary People. New York: Random House, 2001.","Sims - True Stories",2001,"Orlean","Susan","The Bullfighter Checks Her Makeup: My Encounters with Extraordinary People","Primary Works",TRUE
"190","Orlean, Susan. The Orchid Thief. New York: Random House, 1998.","Sims - True Stories",1998,"Orlean","Susan","The Orchid Thief","Primary Works",TRUE
"191","Orwell, George. Down and Out in Paris and London. London: Gollancz, 1933. ","Sims - True Stories",1933,"Orwell","George","Down and Out in Paris and London","Primary Works",TRUE
"192","Orwell, George. Homage to Catalonia. London: Secker & Warburg, 1938.","Sims - True Stories",1938,"Orwell","George","Homage to Catalonia","Primary Works",TRUE
"193","Orwell, George. The Road to Wigan Pier. London: Gollancz, 1937.","Sims - True Stories",1937,"Orwell","George","The Road to Wigan Pier","Primary Works",TRUE
"194","Paterniti, Michael. Driving Mr. Albert: A Trip Across America with Einstein’s Brain. New York: Dial Press, 2000.","Sims - True Stories",2000,"Paterniti","Michael","Driving Mr","Primary Works",TRUE
"195","Paul, Elliot. The Last Time I Saw Paris. New York: Random House, 1942.","Sims - True Stories",1942,"Paul","Elliot","The Last Time I Saw Paris","Primary Works",TRUE
"196","Paul, Elliot. The Life and Death of a Spanish Town. New York: Random House, 1937. Reprinted by Greenwood Press, 1971.","Sims - True Stories",1971,"Paul","Elliot","The Life and Death of a Spanish Town","Primary Works",TRUE
"197","Plimpton, George. Paper Lion. New York: HarperCollins, 1966.","Sims - True Stories",1966,"Plimpton","George","Paper Lion","Primary Works",TRUE
"198","Preston, Richard. First Light: The Search for the Edge of the Universe. New York: Atlantic Monthly Press, 1987.","Sims - True Stories",1987,"Preston","Richard","First Light: The Search for the Edge of the Universe","Primary Works",TRUE
"199","Preston, Richard. The Demon in the Freezer: A True Story. New York: Random House, 2002.","Sims - True Stories",2002,"Preston","Richard","The Demon in the Freezer: A True Story","Primary Works",TRUE
"200","Preston, Richard. The Hot Zone. New York: Random House, 1994.","Sims - True Stories",1994,"Preston","Richard","The Hot Zone","Primary Works",TRUE
"201","Quammen, David. Natural Acts: A Sidelong View of Science and Nature. New York: Schocken Books,1985.","Sims - True Stories",1985,"Quammen","David","Natural Acts: A Sidelong View of Science and Nature","Primary Works",TRUE
"202","Quammen, David. The Song of the Dodo: Island Biogeography in an Age of Extinctions. New York: Scribner, 1996.","Sims - True Stories",1996,"Quammen","David","The Song of the Dodo: Island Biogeography in an Age of Extinctions","Primary Works",TRUE
"203","Raban, Jonathan. Bad Land: An American Romance. New York: Pantheon, 1996.","Sims - True Stories",1996,"Raban","Jonathan","Bad Land: An American Romance","Primary Works",TRUE
"204","Raban, Jonathan. Old Glory: A Voyage Down the Mississippi. New York: Vintage Reprint edition, 1998.","Sims - True Stories",1998,"Raban","Jonathan","Old Glory: A Voyage Down the Mississippi","Primary Works",TRUE
"205","Reed, John. Takes: Stories from The Talk of the Town. New York: Congdon & Weed, Inc., 1983.","Sims - True Stories",1983,"Reed","John","Takes: Stories from The Talk of the Town","Primary Works",TRUE
"206","Reed, John. Talk Stories. New York: Simon and Schuster, 1966.","Sims - True Stories",1966,"Reed","John","Talk Stories","Primary Works",TRUE
"207","Reed, John. Ten Days That Shook the World. Foreword by V. I. Lenin. New York: Vintage Books, 1960. First published 1919.","Sims - True Stories",1919,"Reed","John","Ten Days That Shook the World","Primary Works",TRUE
"208","Reed, John. The War in Eastern Europe. New York: Charles Scribner's Sons, 1918. ","Sims - True Stories",1918,"Reed","John","The War in Eastern Europe","Primary Works",TRUE
"209","Rhodes, Richard. Farm: A Year in the Life of an American Farmer. New York: Simon and Schuster, 1989.","Sims - True Stories",1989,"Rhodes","Richard","Farm: A Year in the Life of an American Farmer","Primary Works",TRUE
"210","Rhodes, Richard. The Making of the Atomic Bomb. New York: Simon and Schuster, 1986. ","Sims - True Stories",1986,"Rhodes","Richard","The Making of the Atomic Bomb","Primary Works",TRUE
"211","Riis, Jacob A. How the Other Half Lives: Studies Among the Tenements of New York. New York: Charles Scribner’s Sons, 1890.","Sims - True Stories",1890,"Riis","Jacob","How the Other Half Lives: Studies Among the Tenements of New York","Primary Works",TRUE
"212","Ross, Lillian. Picture: John Huston, M.G. M., and the Making of The Red Badge of Courage. New York: Limelight Editions, 1984. First published in 1952. ","Sims - True Stories",1952,"Ross","Lillian","Picture: John Huston, M.G","Primary Works",TRUE
"213","Ross, Lillian. Reporting. New York: Dodd, Mead & Co., 1964, 1981.","Sims - True Stories",1981,"Ross","Lillian","Reporting","Primary Works",TRUE
"214","Sacco, Joe. Palestine. With an introduction by Edward Said. Seattle: Fantagraphics Books, 2001.","Sims - True Stories",2001,"Sacco","Joe","Palestine","Primary Works",TRUE
"215","Sager, Mike. Scary Monsters and Super Freaks: Stories of Sex, Drugs, Rock ’N’ Roll and Murder. New York: Thunder’s Mouth Press, 2004.","Sims - True Stories",2004,"Sager","Mike","Scary Monsters and Super Freaks: Stories of Sex, Drugs, Rock ’N’ Roll and Murder","Primary Works",TRUE
"216","Sager, Mike. The Revenge of the Donut Boys: True Stories of Fame, Lust, Survival, and Multiple Personalities. New York: Thunder’s Mouth Press, 2007. ","Sims - True Stories",2007,"Sager","Mike","The Revenge of the Donut Boys: True Stories of Fame, Lust, Survival, and Multiple Personalities","Primary Works",TRUE
"217","Schuyler, Eugene. Turkistan: Notes of a Journey in Russian Turkistan, Kokand, Bukhara and Kuldja. Edited and with an introduction by Geoffrey Wheeler; abridged by K. E. West. New York, Washington: Frederick A. Praeger, 1966. Originally published in two volumes, New York: Scribner, Armstrong & Co., 1877.","Sims - True Stories",1877,"Schuyler","Eugene","Turkistan: Notes of a Journey in Russian Turkistan, Kokand, Bukhara and Kuldja","Primary Works",TRUE
"218","Sheehan, Susan. A Welfare Mother. New York: New American Library, 1976.","Sims - True Stories",1976,"Sheehan","Susan","A Welfare Mother","Primary Works",TRUE
"219","Sheehan, Susan. Is There No Place on Earth for Me? Boston: Houghton Mifflin, 1982.","Sims - True Stories",1982,"Sheehan","Susan","Sheehan, Susan. Is There No Place on Earth for Me? Boston: Houghton Mifflin, 1982.","Primary Works",TRUE
"220","Sheehan, Susan. Kate Quinton's Days. Boston: Houghton Mifflin, 1984.","Sims - True Stories",1984,"Sheehan","Susan","Kate Quinton's Days","Primary Works",TRUE
"221","Shirer, William L. Berlin Diary. New York: Alfred A. Knopf, 1941.","Sims - True Stories",1941,"Shirer","William","Berlin Diary","Primary Works",TRUE
"222","Sims, Patsy. Can Somebody Shout Amen!: Inside the Tents and Tabernacles of American Revivalists. Lexington: University Press of Kentucky, reprint 1996; originally published 1988.","Sims - True Stories",1988,"Sims","Patsy","Can Somebody Shout Amen!: Inside the Tents and Tabernacles of American Revivalists","Primary Works",TRUE
"223","Sims, Patsy. The Klan. Lexington: University Press of Kentucky, reprint 1996; originally published 1978.","Sims - True Stories",1978,"Sims","Patsy","The Klan","Primary Works",TRUE
"224","Singer, Mark. Character Studies: Encounters with the Curiously Obsessed. Boston and New York: Houghton Mifflin, 2005.","Sims - True Stories",2005,"Singer","Mark","Character Studies: Encounters with the Curiously Obsessed","Primary Works",TRUE
"225","Singer, Mark. Funny Money. New York: Alfred A. Knopf, 1985.","Sims - True Stories",1985,"Singer","Mark","Funny Money","Primary Works",TRUE
"226","Singer, Mark. Mr. Personality: Profiles and Talk Pieces. New York: Alfred A. Knopf, 1989.","Sims - True Stories",1989,"Singer","Mark","Mr","Primary Works",TRUE
"227","Snow, Edgar. Red China Today. New York: Random House, 1970. Orignally published as The Other Side of the River in 1962.","Sims - True Stories",1962,"Snow","Edgar","Red China Today","Primary Works",TRUE
"228","Steinbeck, John. A Russian Journal. With pictures by Robert Capa. New York: Viking, 1948. ","Sims - True Stories",1948,"Steinbeck","John","A Russian Journal","Primary Works",TRUE
"229","Steinbeck, John. Bombs Away: The Story of a Bomber Team. New York: Viking, 1942.","Sims - True Stories",1942,"Steinbeck","John","Bombs Away: The Story of a Bomber Team","Primary Works",TRUE
"230","Steinbeck, John. Once There Was a War. New York: Viking, 1958. First published in 1943. ","Sims - True Stories",1943,"Steinbeck","John","Once There Was a War","Primary Works",TRUE
"231","Steinbeck, John. The New Meaning of Treason. New York: Viking, 1964.","Sims - True Stories",1964,"Steinbeck","John","The New Meaning of Treason","Primary Works",TRUE
"232","Steinbeck, John. Travels with Charley; In Search of America. New York: Viking, 1962.","Sims - True Stories",1962,"Steinbeck","John","Travels with Charley; In Search of America","Primary Works",TRUE
"233","Talese, Gay. Honor Thy Father. New York: Fawcett-World, 1972.","Sims - True Stories",1972,"Talese","Gay","Honor Thy Father","Primary Works",TRUE
"234","Talese, Gay. The Kingdom and The Power. New York: World Publishing Co., 1966. ","Sims - True Stories",1966,"Talese","Gay","The Kingdom and The Power","Primary Works",TRUE
"235","Talese, Gay. Thy Neighbor's Wife. Garden City, N.Y.: Doubleday, 1980.","Sims - True Stories",1980,"Talese","Gay","Thy Neighbor's Wife","Primary Works",TRUE
"236","Thompson, Hunter. Fear and Loathing in Las Vegas: A Savage Journey to the Heart of the American Dream. New York: Popular Library, 1971.","Sims - True Stories",1971,"Thompson","Hunter","Fear and Loathing in Las Vegas: A Savage Journey to the Heart of the American Dream","Primary Works",TRUE
"237","Thompson, Hunter. Hell’s Angels. New York: Random House, 1967.","Sims - True Stories",1967,"Thompson","Hunter","Hell’s Angels","Primary Works",TRUE
"238","Thompson, Hunter. The Great Shark Hunt. New York: Fawcett, 1979.","Sims - True Stories",1979,"Thompson","Hunter","The Great Shark Hunt","Primary Works",TRUE
"239","Tosches, Nick. Killings. New York: Ticknor & Fields, 1984.","Sims - True Stories",1984,"Tosches","Nick","Killings","Primary Works",TRUE
"240","Tosches, Nick. U.S. Journal. New York: Dutton, 1971.","Sims - True Stories",1971,"Tosches","Nick","U.S","Primary Works",TRUE
"241","Tosches, Nick. Where Dead Voices Gather. Boston: Little, Brown and Co., 2001. ","Sims - True Stories",2001,"Tosches","Nick","Where Dead Voices Gather","Primary Works",TRUE
"242","Trillin, Calvin. American Stories. New York: Ticknor & Fields, 1991.","Sims - True Stories",1991,"Trillin","Calvin","American Stories","Primary Works",TRUE
"243","Turgenev, Ivan. A Sportsman's Notebook. New York: Viking, 1950. Originally published 1852.","Sims - True Stories",1852,"Turgenev","Ivan","A Sportsman's Notebook","Primary Works",TRUE
"244","Twain, Mark. Early Tales & Sketches. Vols. 1 (1851-1864) and 2 (1864-1865). Edited by Edgar Marquess Branch and Robert H. Hirst with the assistance of Harriet Elinor Smith. Berkeley, Los Angeles: University of California Press, 1979.","Sims - True Stories",1979,"Twain","Mark","Early Tales & Sketches","Primary Works",TRUE
"245","Twain, Mark. Innocents Abroad: or, The New Pilgrim's Progress. New York: Signet Classics, 1966; originally published 1869.","Sims - True Stories",1869,"Twain","Mark","Innocents Abroad: or, The New Pilgrim's Progress","Primary Works",TRUE
"246","Twain, Mark. Life on the Mississippi. New York: New American Library, 1980. Originally published 1883.","Sims - True Stories",1883,"Twain","Mark","Life on the Mississippi","Primary Works",TRUE
"247","Twain, Mark. Roughing It. Hartford, Conn.: American Publishing Co., 1895; originally published 1871.","Sims - True Stories",1871,"Twain","Mark","Roughing It","Primary Works",TRUE
