"","Full Citation","Source","Year","Author Last Name","Author First Name","Title","Type","`Full Citation` == `Full Citation`"
"466","Lemann, Nicholas. Panel discussion: “America: What’s the Story?: The Uses and Abuses of Narrative in Nonfiction: the World, the Word, and the Future: Sesquicentennial Discussion on the State of the Literary Arts.” New York State Writers Center, Albany, N.Y. 18 Nov. 1994.","LJS Bibliography",1994,"Lemann","Nicholas","America: What’s the Story?: The Uses and Abuses of Narrative in Nonfiction: the World, the Word, and the Future: Sesquicentennial Discussion on the State of the Literary Arts","Secondary Works",TRUE
"467","Lewis, Oscar. Introduction. Frank Norris of “The Wave”: Stories & Sketches from the San Francisco Weekly, 1893 to 1897. San Francisco: Westgate Press, 1931. 1–15.","LJS Bibliography",1931,"Lewis","Oscar","Introduction","Secondary Works",TRUE
"468","Lounsberry, Barbara. The Art of Fact: Contemporary Artists of Nonfiction. New York: Greenwood Press, 1990.","LJS Bibliography",1990,"Lounsberry","Barbara","The Art of Fact: Contemporary Artists of Nonfiction","Secondary Works",TRUE
"469","Lule, Jack. “Joe Eszterhas.” A Sourcebook of American Literary Journalism: Representative Writers in an Emerging Genre. Ed. Thomas B. Connery. New York: Greenwood Press, 1992. 307–16.","LJS Bibliography",1992,"Lule","Jack","Joe Eszterhas","Secondary Works",TRUE
"470","Maguire, Roberta. “Riffing on Hemingway and Burke, Responding to Mailer and Wolfe: Albert Murray’s ‘Anti- Journalism.’” Literary Journalism Studies 2, no. 2 (Fall 2010): 9-26.","LJS Bibliography",2010,"Maguire","Roberta","Riffing on Hemingway and Burke, Responding to Mailer and Wolfe: Albert Murray’s ‘Anti- Journalism.","Secondary Works",TRUE
"471","Mansell, Darrel. “Unsettling the Colonel’s Hash: ‘Fact’ in Autobiography.” Literary Journalism in the Twentieth Century. Ed. Norman Sims. New York: Oxford University Press, 1990. 261-280.","LJS Bibliography",1990,"Mansell","Darrel","Unsettling the Colonel’s Hash: ‘Fact’ in Autobiography","Secondary Works",TRUE
"472","Marmarelli, Ronald S. “William Hard.” A Sourcebook of American Literary Journalism: Representative Writers in an Emerging Genre. Ed. Thomas B. Connery. New York: Greenwood Press, 1992. 131–42.","LJS Bibliography",1992,"Marmarelli","Ronald","William Hard","Secondary Works",TRUE
"473","Matalene, Carolyn. Introduction. Telling Stories Taking Risks. Ed. Alice M. Klement and Carolyn B. Matalene. Belmont, Calif.: Wadsworth, 1998. 1–3.","LJS Bibliography",1998,"Matalene","Carolyn","Introduction","Secondary Works",TRUE
"474","McCarthy, Mary. “Artists in Uniform.” Harper’s March 1953. Rpt. in Literary Journalism in the Twentieth Century. Ed. Norman Sims. Evanston, Ill.:Northwestern University Press, 2008. 231–46.","LJS Bibliography",2008,"McCarthy","Mary","Artists in Uniform","Secondary Works",TRUE
"475","McCarthy, Mary. “Settling the Colonel’s Hash.” Harper’s Magazine Feb. 1954. Rpt. in Literary Journalism in the Twentieth Century. Ed. Norman Sims. Evanston, Ill.:Northwestern University Press, 2008. 247–60.","LJS Bibliography",2008,"McCarthy","Mary","Settling the Colonel’s Hash","Secondary Works",TRUE
"476","McKeen, William. Outlaw Journalist: The Life and Times of Hunter S. Thompson. New York: W. W. Norton & Company, 2009.","LJS Bibliography",2009,"McKeen","William","Outlaw Journalist: The Life and Times of Hunter S","Secondary Works",TRUE
"477","Mills, Nicolaus. Introduction. The New Journalism: A Historical Anthology. New York: McGraw-Hill, 1974. xi–xx.","LJS Bibliography",1974,"Mills","Nicolaus","Introduction","Secondary Works",TRUE
"478","Moss, Marilyn Ann. “Theodore Dreiser.” A Sourcebook of American Literary Journalism: Representative Writers in an Emerging Genre. Ed. Thomas B. Connery. New York: Greenwood Press, 1992. 143–50.","LJS Bibliography",1992,"Moss","Marilyn","Theodore Dreiser","Secondary Works",TRUE
"479","Nelson, Jack A. “Mark Twain.” A Sourcebook of American Literary Journalism: Representative Writers in an Emerging Genre. Ed. Thomas B. Connery. New York: Greenwood Press, 1992. 39–42.","LJS Bibliography",1992,"Nelson","Jack","Mark Twain","Secondary Works",TRUE
"480","Nocera, Joseph. “How Hunter Thompson Killed New Journalism.” Washington Monthly, April 1981, 44-50. 20th century; Hunter Thompson; Gonzo journalism, New Journalism; Books, magazines..","LJS Bibliography",1981,"Nocera","Joseph","How Hunter Thompson Killed New Journalism","Secondary Works",TRUE
"481","Norman, Michael. “Writing Narrative Portraiture.” Literary Journalism Studies 1, no. 1 (Spring 2009): 50–56.","LJS Bibliography",2009,"Norman","Michael","Writing Narrative Portraiture","Secondary Works",TRUE
"482","North, Joseph. “Reportage.” American Writer’s Congress. Ed. Henry Hart. New York: International, 1935. 120–23.","LJS Bibliography",1935,"North","Joseph","Reportage","Secondary Works",TRUE
"483","Nuttall, Nick. “Cold-Blooded Journalism: Truman Capote and the Non-fiction Novel.” The Journalistic Imagination: Literary Journalists from Defoe to Capote and Carter. Ed. Richard Keeble and Sharon Wheeler. London: Routledge, 2007. 130– 44.","LJS Bibliography",2007,"Nuttall","Nick","Cold-Blooded Journalism: Truman Capote and the Non-fiction Novel","Secondary Works",TRUE
"484","O’Connor, William Van, and Frederick J. Hoffman. Preface. American Non-Fiction: 1900–1950. 1952. Westport, Conn.: Greenwood Press, 1970. v–vii.","LJS Bibliography",1970,"O’Connor","William","Hoffman","Secondary Works",TRUE
"485","Ohmann, Richard. “Politics and Genre in Nonfiction Prose.” New Literary History 11, no. 2 (1980): 237–44.","LJS Bibliography",1980,"Ohmann","Richard","Politics and Genre in Nonfiction Prose","Secondary Works",TRUE
"486","Palmer, Ruth. “The Hoax, Uncanny Identity, and Literary Journalism.” Literary Journalism Studies 2, no. 1 (Spring 2010): 85–105.","LJS Bibliography",2010,"Palmer","Ruth","The Hoax, Uncanny Identity, and Literary Journalism","Secondary Works",TRUE
"487","Parisi, Peter. “Lincoln Steffens.” A Sourcebook of American Literary Journalism: Representative Writers in an Emerging Genre. Ed. Thomas B. Connery. New York: Greenwood Press, 1992. 101–10.","LJS Bibliography",1992,"Parisi","Peter","Lincoln Steffens","Secondary Works",TRUE
"488","Paterson, Judith. “Literary Journalism’s Twelve Best.” Washington Journalism Review Oct. 1992: 61.","LJS Bibliography",1992,"Paterson","Judith","Literary Journalism’s Twelve Best","Secondary Works",TRUE
"489","Pauly, John J. “Damon Runyon.” A Sourcebook of American Literary Journalism: Representative Writers in an Emerging Genre. Ed. Thomas B. Connery. New York: Greenwood Press, 1992. 169–78.","LJS Bibliography",1992,"Pauly","John","Damon Runyon","Secondary Works",TRUE
"490","Pauly, John J. “George Ade.” A Sourcebook of American Literary Journalism: Representative Writers in an Emerging Genre. Ed. Thomas B. Connery. New York: Greenwood Press, 1992. 111–20.","LJS Bibliography",1992,"Pauly","John","George Ade","Secondary Works",TRUE
"491","Peck, David. “Joseph North and the Proletarian Reportage of the 1930s.” Zeitschrift furAnglistik und Amerikanistick 33, no. 3 (1985): 210–20.","LJS Bibliography",1985,"Peck","David","Joseph North and the Proletarian Reportage of the 1930s","Secondary Works",TRUE
"492","Peeler, David P. “Unlonesome Highways: The Quest for Fact and Fellowship in Depression America.” Journal of American Studies 18, no. 2 (1984): 186–206.","LJS Bibliography",1984,"Peeler","David","Unlonesome Highways: The Quest for Fact and Fellowship in Depression America","Secondary Works",TRUE
"493","Pizer, Donald. “Documentary Narrative as Art: William Manchester and Truman Capote.” The Reporter as Artist: A Look at the New Journalism Controversy. Ed. Ronald Weber. New York: Hastings House, 1974. 207–19.","LJS Bibliography",1974,"Pizer","Donald","Documentary Narrative as Art: William Manchester and Truman Capote","Secondary Works",TRUE
"494","Podhoretz, Norman. “The Article as Art.” Harper’s July 1958: 74–79.","LJS Bibliography",1958,"Podhoretz","Norman","The Article as Art","Secondary Works",TRUE
"495","Polsgrove, Carol. “Gay Talese.” A Sourcebook of American Literary Journalism: Representative Writers in an Emerging Genre. Ed. Thomas B. Connery. New York: Greenwood Press, 1992. 261–71.","LJS Bibliography",1992,"Polsgrove","Carol","Gay Talese","Secondary Works",TRUE
"496","Powers, Thomas. “Cry Wolfe.” Commonweal 102 (1975): 497–99.","LJS Bibliography",1975,"Powers","Thomas","Cry Wolfe","Secondary Works",TRUE
"497","Quinn, Katrina J. “Exploring an Early Version of Literary Journalism: Nineteenth-century Epistolary Journalism,” Literary Journalism Studies 3, no. 1 (Spring 2011): 33–51.","LJS Bibliography",2011,"Quinn","Katrina","Exploring an Early Version of Literary Journalism: Nineteenth-century Epistolary Journalism","Secondary Works",TRUE
"498","Reynolds, Bill “Recovering the Peculiar Life and Times of Tom Hedley and Canadian New Journalism.” Literary Journalism Studies 1, no. 1 (Spring 2009): 79–104.","LJS Bibliography",2009,"Reynolds","Bill","Recovering the Peculiar Life and Times of Tom Hedley and Canadian New Journalism","Secondary Works",TRUE
"499","Ringnalda, Donald. “Michael Herr.” A Sourcebook of American Literary Journalism: Representative Writers in an Emerging Genre. Ed. Thomas B. Connery. New York: Greenwood Press, 1992. 281–95.","LJS Bibliography",1992,"Ringnalda","Donald","Michael Herr","Secondary Works",TRUE
"500","Rischin, Moses. Introduction. Grandma Never Lived in America: The New Journalism of Abraham Cahan. Ed. Moses Rischin. Bloomington: Indiana University Press, 1985. xviii–xliv.","LJS Bibliography",1985,"Rischin","Moses","Introduction","Secondary Works",TRUE
"501","Roberts, Arthur. “Lillian Ross.” A Sourcebook of American Literary Journalism: Representative Writers in an Emerging Genre. Ed. Thomas B. Connery. New York: Greenwood Press, 1992. 231–37.","LJS Bibliography",1992,"Roberts","Arthur","Lillian Ross","Secondary Works",TRUE
"502","Roberts, Nancy. “Dorothy Day.” A Sourcebook of American Literary Journalism: Representative Writers in an Emerging Genre. Ed. Thomas B. Connery. New York: Greenwood Press, 1992. 179–85.","LJS Bibliography",1992,"Roberts","Nancy","Dorothy Day","Secondary Works",TRUE
"503","Robertson, Michael. “Stephen Crane.” A Sourcebook of American Literary Journalism: Representative Writers in an Emerging Genre. Ed. Thomas B. Connery. New York: Greenwood Press, 1992. 69–79.","LJS Bibliography",1992,"Robertson","Michael","Stephen Crane","Secondary Works",TRUE
"504","Robertson, Michael. Stephen Crane, Journalism, and the Making of Modern American Literature. New York: Columbia University Press, 1997. ","LJS Bibliography",1997,"Robertson","Michael","Stephen Crane, Journalism, and the Making of Modern American Literature","Secondary Works",TRUE
"505","Roggenkamp, Karen. Narrating the News: New Journalism and Literary Genre in Late Nineteenth-Century American Newspapers and Fiction. Kent, Ohio: Kent State University Press, 2005.","LJS Bibliography",2005,"Roggenkamp","Karen","Narrating the News: New Journalism and Literary Genre in Late Nineteenth-Century American Newspapers and Fiction","Secondary Works",TRUE
"506","Roiland, Joshua. “Getting Away from It All: The Literary Journalism of David Foster Wallace and Nietzsche’s Concept of Oblivion.” Literary Journalism Studies 1, no. 2 (Fall 2009): 89–105.","LJS Bibliography",2009,"Roiland","Joshua","Getting Away from It All: The Literary Journalism of David Foster Wallace and Nietzsche’s Concept of Oblivion","Secondary Works",TRUE
"507","Russell, John. Reciprocities in the Nonfiction Novel. Athens, Ga.: University of Georgia Press, 2000.","LJS Bibliography",2000,"Russell","John","Reciprocities in the Nonfiction Novel","Secondary Works",TRUE
"508","Ryan, Maureen. “Green Visors and Ivory Towers: Jean Stafford and the New Journalism.” The Kenyon Review 16, no. 4(1994): 102–19.","LJS Bibliography",1994,"Ryan","Maureen","Green Visors and Ivory Towers: Jean Stafford and the New Journalism","Secondary Works",TRUE
"509","Rygiel, Dennis. “Style in Twentieth-Century Literary Nonfiction in English: An Annotated Bibliography of Criticism, 1980–1988.” Style 23 (1989): 566–617.","LJS Bibliography",1989,"Rygiel","Dennis","Style in Twentieth-Century Literary Nonfiction in English: An Annotated Bibliography of Criticism, 1980–1988","Secondary Works",TRUE
"510","Rygiel, Dennis. “Stylistics and the Study of Twentieth-Century Literary Nonfiction.” Literary Nonfiction: Theory, Criticism, Pedagogy. Ed. Chris Anderson. Carbondale, Ill.: Southern Illinois University Press, 1989. 3–28.","LJS Bibliography",1989,"Rygiel","Dennis","Stylistics and the Study of Twentieth-Century Literary Nonfiction","Secondary Works",TRUE
"511","Sauerberg, Lars Ole. Fact into Fiction: Documentary Realism in the Contemporary Novel. New York: St. Martin’s Press, 1991.","LJS Bibliography",1991,"Sauerberg","Lars","Fact into Fiction: Documentary Realism in the Contemporary Novel","Secondary Works",TRUE
"512","Schmuhl, Robert. “Richard Ben Cramer.” A Sourcebook of American Literary Journalism: Representative Writers in an Emerging Genre. Ed. Thomas B. Connery. New York: Greenwood Press, 1992. 331–42.","LJS Bibliography",1992,"Schmuhl","Robert","Richard Ben Cramer","Secondary Works",TRUE
"513","Schultz, William Todd. “Off-stage Voices in James Agee’s Let Us Now Praise Famous Men: Reportage as Covert Autobiography.” American Imago 56, no. 1 (Spring 1999): 75–104.","LJS Bibliography",1999,"Schultz","William","Off-stage Voices in James Agee’s Let Us Now Praise Famous Men: Reportage as Covert Autobiography","Secondary Works",TRUE
"514","Schuster, Charles I. “The Nonfictional Prose of Richard Selzer: an Aesthetic Analysis.” Literary Nonfiction: Theory, Criticism, Pedagogy. Ed. Chris Anderson. Carbondale, Ill.: Southern Illinois University Press, 1989. 3–28.","LJS Bibliography",1989,"Schuster","Charles","The Nonfictional Prose of Richard Selzer: an Aesthetic Analysis","Secondary Works",TRUE
"515","Segel, Harold B. Egon Erwin Kisch: The Raging Reporter. West Lafayette, Ind.: Purdue University Press, 1992.","LJS Bibliography",1992,"Segel","Harold","Egon Erwin Kisch: The Raging Reporter","Secondary Works",TRUE
"516","Sims, Norman, ed. Literary Journalism in the Twentieth Century. Ed. Norman Sims. Evanston, Ill.: Northwestern University Press, 2008. Reprint of 1990 Oxford University Press edition.","LJS Bibliography",1990,"Sims","Norman","Literary Journalism in the Twentieth Century","Secondary Works",TRUE
"517","Sims, Norman. “Joseph Mitchell and the New Yorker Nonfiction Writers.” Ed. Norman Sims. Literary Journalism in the Twentieth Century. Evanston, Ill.: Northwestern University Press, 2008. 82–109.","LJS Bibliography",2008,"Sims","Norman","Joseph Mitchell and the New Yorker Nonfiction Writers","Secondary Works",TRUE
"518","Sims, Norman. “The Art of Literary Journalism.” Literary Journalism: A New Collection of the Best American Nonfiction. Ed. Norman Sims and Mark Kramer. New York: Ballantine, 1995. 3–19.","LJS Bibliography",1995,"Sims","Norman","The Art of Literary Journalism","Secondary Works",TRUE
"519","Sims, Norman. “The Literary Journalists.” The Literary Journalists. Ed. Norman Sims. New York: Ballantine, 1984. 3–25.","LJS Bibliography",1984,"Sims","Norman","The Literary Journalists","Secondary Works",TRUE
"520","Sims, Norman. “The Problem and the Promise of Literary Journalism Studies.” Literary Journalism Studies 1, no. 1 (Spring 2009): 7–16.","LJS Bibliography",2009,"Sims","Norman","The Problem and the Promise of Literary Journalism Studies","Secondary Works",TRUE
"521","Sims, Norman. True Stories: A Century of Literary Journalism. Evanston, Ill.: Northwestern University Press, 2007.","LJS Bibliography",2007,"Sims","Norman","True Stories: A Century of Literary Journalism","Secondary Works",TRUE
"522","Smith, Kathy. “John McPhee Balances the Act.” Literary Journalism in the Twentieth Century. Ed. Norman Sims. Evanston, Ill.: Norman Sims. Evanston, Ill.:Northwestern University Press, 2008. 206–27.","LJS Bibliography",2008,"Smith","Kathy","John McPhee Balances the Act","Secondary Works",TRUE
"523","Solotaroff, Theodore. “Introduction to Writers and Issues.” The Reporter as Artist: A Look at the New Journalism Controversy. Ed. Ronald Weber. New York: Hastings House, 1974. 161–66.","LJS Bibliography",1974,"Solotaroff","Theodore","Introduction to Writers and Issues","Secondary Works",TRUE
"524","Sommer, Robert. “New Journalism & New Sociology Compared.” Journal of Popular Culture 9, no. 1 (Summer 1975): 241/143-46/48. 20th century; Tom Wolfe, Erving Goffman; New Journalism; Magazines, books.","LJS Bibliography",1975,"Sommer","Robert","New Journalism & New Sociology Compared","Secondary Works",TRUE
"525","Steiner, Linda. “Joe McGinniss.” A Sourcebook of American Literary Journalism: Representative Writers in an Emerging Genre. Ed. Thomas B. Connery. New York: Greenwood Press, 1992. 367–74.","LJS Bibliography",1992,"Steiner","Linda","Joe McGinniss","Secondary Works",TRUE
"526","Sternbergh, Adam. “How James Salter Wrote an Eleven-Page Biography of A.J. Liebling.” In The 6th Floor (blog). New York Times, April 21, 2011. http://6thfloor.blogs.nytimes.com/2011/04/21/how-james-salter-wrote-an-eleven- page-biography-of-a-j-liebling/?ref=thenewyorker. 20th century; James Salter; Sketch; Book; A.J. Liebling.","LJS Bibliography",2011,"Sternbergh","Adam","How James Salter Wrote an Eleven-Page Biography of A.J. Liebling","Secondary Works",TRUE
"527","Stott, William. Documentary Expression and Thirties America. New York: Oxford University Press, 1973.","LJS Bibliography",1973,"Stott","William","Documentary Expression and Thirties America","Secondary Works",TRUE
"528","Talese, Gay. ”Origins of a Nonfiction Writer.” Writing Creative Nonfiction: The Literature of Reality. Ed. Gay Talese and Barbara Lounsberry. New York: HarperCollins), 1996. 1–25.","LJS Bibliography",1996,"Talese","Gay","Ed","Secondary Works",TRUE
"529","Thompson, Matthew. “Outrider: William T. Vollmann, Tony Tanner, and the Private Extremes of an Anti-Journalism,” Literary Journalism Studies 3, no. 1 (Spring 2011): 73–95.","LJS Bibliography",2011,"Thompson","Matthew","Outrider: William T. Vollmann, Tony Tanner, and the Private Extremes of an Anti-Journalism","Secondary Works",TRUE
"530","Thompson, Maurice. “The Prospect of Fiction.” The Independent 52 (1900).","LJS Bibliography",1900,"Thompson","Maurice","The Prospect of Fiction","Secondary Works",TRUE
"531","Troyer, Howard William. Ned Ward of Grubstreet: A Study of Sub-Literary London in the Eighteenth Century. Cambridge: Harvard University Press, 1946.","LJS Bibliography",1946,"Troyer","Howard","Ned Ward of Grubstreet: A Study of Sub-Literary London in the Eighteenth Century","Secondary Works",TRUE
"532","Van Dellen, Robert J. “We've Been Had by the New Journalism: A Put Down.” Journal of Popular Culture 9, no. 1 (Summer 1975): 219/121-31/33. 20th century; New Journalists; Magazines, books; Dishonesty of New Journalism.","LJS Bibliography",1975,"Van Dellen","Robert","We've Been Had by the New Journalism: A Put Down","Secondary Works",TRUE
"533","Wakefield, Dan. “The Personal Voice and the Impersonal Eye.” The Reporter as Artist: A Look at the New Journalism Controversy. Ed. Ronald Weber. New York: Hastings House, 1974. 39–48.","LJS Bibliography",1974,"Wakefield","Dan","The Personal Voice and the Impersonal Eye","Secondary Works",TRUE
"534","Warner, Langdon. “The Editor’s Clearing-House: Need Journalism Destroy Literature?” The Critic 48 (1906): 469–70.","LJS Bibliography",1906,"Warner","Langdon","The Editor’s Clearing-House: Need Journalism Destroy Literature","Secondary Works",TRUE
"535","Webb, Joseph. “Historical Perspective on the New Journalism.” Journalism History, 1.2 (1974): 38+.","LJS Bibliography",1974,"Webb","Joseph","Historical Perspective on the New Journalism","Secondary Works",TRUE
"536","Weber, Ronald, ed. The Reporter as Artist: A Look at the New Journalism Controversy. New York: Hastings House, 1974.","LJS Bibliography",1974,"Weber","Ronald","The Reporter as Artist: A Look at the New Journalism Controversy","Secondary Works",TRUE
"537","Weber, Ronald. “Hemingway’s Permanent Records.” Literary Journalism in the Twentieth Century. Ed. Norman Sims. Evanston, Ill.: Northwestern University Press, 2008. 21–52.","LJS Bibliography",2008,"Weber","Ronald","Hemingway’s Permanent Records","Secondary Works",TRUE
"538","Weber, Ronald. “Moon Talk.” Journal of Popular Culture 9, no. 1 (Summer 1975): 142/44-52/54. 20th century; Tom Wolfe, Norman Mailer, Philip Roth, John Updike; New Journalism; Books; Space exploration.","LJS Bibliography",1975,"Weber","Ronald","Moon Talk","Secondary Works",TRUE
"539","Weber, Ronald. “Some Sort of Artistic Excitement.” The Reporter as Artist: A Look at the New Journalism Controversy. New York: Hastings House, 1974. 13–23.","LJS Bibliography",1974,"Weber","Ronald","Some Sort of Artistic Excitement","Secondary Works",TRUE
"540","Weber, Ronald. The Literature of Fact: Literary Nonfiction in American Writing. Athens, Ohio: Ohio University Press, 1980.","LJS Bibliography",1980,"Weber","Ronald","The Literature of Fact: Literary Nonfiction in American Writing","Secondary Works",TRUE
"541","Weingarten, Marc. The Gang That Wouldn’t Write Straight: Wolfe, Thompson, Didion, and the New Journalism Revolution. New York: Crown Publishers, 2006.","LJS Bibliography",2006,"Weingarten","Marc","The Gang That Wouldn’t Write Straight: Wolfe, Thompson, Didion, and the New Journalism Revolution","Secondary Works",TRUE
"542","Weirather, Larry. “Tom Wolfe's Snake River Canyon Jump.” Journal of Popular Culture 9, no. 1 (Summer 1975): 211/113- 18/20. 20th century; Tom Wolfe; Magazines, books; Popular reception of New Journalism.","LJS Bibliography",1975,"Weirather","Larry","Tom Wolfe's Snake River Canyon Jump","Secondary Works",TRUE
"543","Whitby, Gary L. A Sourcebook of American Literary Journalism: Representative Writers in an Emerging Genre. Ed. Thomas B. Connery. New York: Greenwood Press, 1992. 239–48.","LJS Bibliography",1992,"Whitby","Gary","A Sourcebook of American Literary Journalism: Representative Writers in an Emerging Genre","Secondary Works",TRUE
"544","Whitt, Jan. ”From The Jungle to Food Lion: The History Lessons of Investigative Journalism.” Journalism History 34 (Fall 2008):170–73.","LJS Bibliography",2008,"Whitt","Jan","Whitt, Jan. ”From The Jungle to Food Lion: The History Lessons of Investigative Journalism.” Journalism History 34 (Fall 2008):170–73.","Secondary Works",TRUE
"545","Whitt, Jan. Settling the Borderland: Other Voices in Literary Journalism. Lanham, Md.: University Press of America, 2008.","LJS Bibliography",2008,"Whitt","Jan","Settling the Borderland: Other Voices in Literary Journalism","Secondary Works",TRUE
"546","Wilson, Deborah. “An Unscathed Tourist of Wars: The Journalism of Martha Gellhorn.” The Journalistic Imagination: Literary Journalists from Defoe to Capote and Carter. Ed. Richard Keeble and Sharon Wheeler. London: Routledge, 2007. 116–29.","LJS Bibliography",2007,"Wilson","Deborah","An Unscathed Tourist of Wars: The Journalism of Martha Gellhorn","Secondary Works",TRUE
"547","Winterowd, W. Ross. The Rhetoric of the “Other” Literature. Carbondale, Ill.: Southern Illinois University Press, 1990. Wolfe, Tom. “The New Journalism.” The New Journalism: With an Anthology. Ed. Tom Wolfe and E. W. Johnson. New York: Harper, 1973. 3–64.","LJS Bibliography",1973,"Winterowd","W","The New Journalism","Secondary Works",TRUE
"548","Yagoda, Ben. About Town: The New Yorker and the World It Made. New York: Da Capo Press, 2001.","LJS Bibliography",2001,"Yagoda","Ben","About Town: The New Yorker and the World It Made","Secondary Works",TRUE
"549","Yagoda, Ben. Preface. The Art of Fact: A Historical Anthology of Literary Journalism. Ed. Kevin Kerrane and Ben Yagoda. New York: Scribner, 1997. 13–16.","LJS Bibliography",1997,"Yagoda","Ben","Preface","Secondary Works",TRUE
"550","Zavarzadeh, Mas’ud. The Mythopoeic Reality: The Postwar American Nonfiction Novel. Urbana: University of Illinois Press, 1976.","LJS Bibliography",1976,"Zavarzadeh","Mas","The Mythopoeic Reality: The Postwar American Nonfiction Novel","Secondary Works",TRUE
"551","Zdovc, Sonja Merljak. Literary Journalism in the United States of America and Slovenia. Lanham, Md.: University Press of America, 2008.","LJS Bibliography",2008,"Zdovc","Sonja","Literary Journalism in the United States of America and Slovenia","Secondary Works",TRUE
"552","Anonymous, Anonymous. “Borderland of Literature,” in Spectator 71:513 (Oct. 14, 1893).","Sims - LJ in the 20th Century",1893,"Anonymous","Anonymous","Borderland of Literature","Secondary Works",TRUE
"553","Anonymous, Anonymous. “Confessions of a Literary Journalist,” in Bookman 26:370-76 (Dec. 1907).","Sims - LJ in the 20th Century",1907,"Anonymous","Anonymous","Confessions of a Literary Journalist","Secondary Works",TRUE
"554","Anonymous, Anonymous. “Plea for Literary Journalism,” in Harper’s Weekly, 46:1558 (Oct. 25, 1902).","Sims - LJ in the 20th Century",1902,"Anonymous","Anonymous","Plea for Literary Journalism","Secondary Works",TRUE
"555","Anonymous, Anonymous. “The Point of View: The Newspaper and Fiction,” in Scribner’s Magazine 40:122-24 (July 1906).","Sims - LJ in the 20th Century",1906,"Anonymous","Anonymous","The Point of View: The Newspaper and Fiction","Secondary Works",TRUE
