"","Full Citation","Source","Year","Author Last Name","Author First Name","Title","Type","`Full Citation` == `Full Citation`"
"248","Twain, Mark. The Complete Humorous Sketches and Tales of Mark Twain. Edited, and with an introduction, by Charles Neider. Garden City, N.Y.: Doubleday & Co., 1961.","Sims - True Stories",1961,"Twain","Mark","The Complete Humorous Sketches and Tales of Mark Twain","Primary Works",TRUE
"249","Ungar, Sanford J. Fresh Blood: The New American Immigrants. New York: Simon & Schuster, 1995.","Sims - True Stories",1995,"Ungar","Sanford","Fresh Blood: The New American Immigrants","Primary Works",TRUE
"250","Wambaugh, Joseph. The Onion Field. New York: Delacorte Press, 1973.","Sims - True Stories",1973,"Wambaugh","Joseph","The Onion Field","Primary Works",TRUE
"251","Werth, Barry. Damages: One Family’s Legal Struggles in the World of Medicine. New York: Simon and Schuster, 1998.","Sims - True Stories",1998,"Werth","Barry","Damages: One Family’s Legal Struggles in the World of Medicine","Primary Works",TRUE
"252","Weschler, Lawrence. Shapinsky's Karma, Bogg's Bills: And Other True-Life Tales. New York: North Point Press, 1988.","Sims - True Stories",1988,"Weschler","Lawrence","Shapinsky's Karma, Bogg's Bills: And Other True-Life Tales","Primary Works",TRUE
"253","West, Rebecca. Black Lamb and Grey Falcon; A Journey through Yugoslavia. New York: Viking, 1941.","Sims - True Stories",1941,"West","Rebecca","Black Lamb and Grey Falcon; A Journey through Yugoslavia","Primary Works",TRUE
"254","West, Rebecca. Rebecca West — A Celebration. Selected from her writings, with a critical introduction by Samuel Hynes. New York: Penguin Books, 1978. ","Sims - True Stories",1978,"West","Rebecca","Rebecca West — A Celebration","Primary Works",TRUE
"255","West, Rebecca. The Young Rebecca: Writings of Rebecca West 1911–17. Selected and introduced by Jane Marcus. New York: Viking, 1982.","Sims - True Stories",1982,"West","Rebecca","The Young Rebecca: Writings of Rebecca West 1911–17","Primary Works",TRUE
"256","White, E. B. Essays of E. B. White. New York: Harper Colophon Books, 1977. ","Sims - True Stories",1977,"White","E","B","Primary Works",TRUE
"257","White, E. B. Here Is New York. New York: Harper & Brothers, 1949.","Sims - True Stories",1949,"White","E","B","Primary Works",TRUE
"258","White, E. B. The Second Tree from the Corner. New York: Harper & Row, 1965. Since 1960","Sims - True Stories",1960,"White","E","B","Primary Works",TRUE
"259","White, Theodore H. The Making of the President 1960. New York: Atheneum, 1961.","Sims - True Stories",1961,"White","Theodore","The Making of the President 1960","Primary Works",TRUE
"260","Whynott, Douglas. A Country Practice: Scenes from the Veterinary Life. New York: North Point Press, 2004.","Sims - True Stories",2004,"Whynott","Douglas","A Country Practice: Scenes from the Veterinary Life","Primary Works",TRUE
"261","Whynott, Douglas. A Unit of Water. A Unit of Time: Joel White’s Last Boat. New York: Doubleday, 1999; Washington Square Press, Pocket Books, 2000. Wicker, Tom. A Time to Die. New York: Quadrangle, 1975.","Sims - True Stories",1975,"Whynott","Douglas","A Unit of Water","Primary Works",TRUE
"262","Whynott, Douglas. Following the Bloom: Across America with the Migratory Beekeepers. Mechanicsburg, Penn.: Stackpole Books, 1991; Penguin/Tarcher, 2004. ——. Giant Bluefin. New York: Farrar, Straus and Giroux, 1995.","Sims - True Stories",1995,"Whynott","Douglas","Following the Bloom: Across America with the Migratory Beekeepers","Primary Works",TRUE
"263","Wideman, John Edgar. Brothers & Keepers. New York: Holt Rinehart and Winston, 1984.","Sims - True Stories",1984,"Wideman","John","Brothers & Keepers","Primary Works",TRUE
"264","Wilkinson, Alec. Midnights: A Year with the Wellfleet Police. New York: Random House, 1982.","Sims - True Stories",1982,"Wilkinson","Alec","Midnights: A Year with the Wellfleet Police","Primary Works",TRUE
"265","Wilson, Edmund. The American Earthquake. Garden City, N.Y.: Doubleday & Co., 1958.","Sims - True Stories",1958,"Wilson","Edmund","The American Earthquake","Primary Works",TRUE
"266","Wolfe, Tom. Hooking Up. New York: Farrar Straus Giroux, 2000.","Sims - True Stories",2000,"Wolfe","Tom","Hooking Up","Primary Works",TRUE
"267","Wolfe, Tom. Radical Chic and Mau-Mauing the Flak Catchers. New York: Farrar, Straus & Giroux, 1970.","Sims - True Stories",1970,"Wolfe","Tom","Radical Chic and Mau-Mauing the Flak Catchers","Primary Works",TRUE
"268","Wolfe, Tom. The Electric Kool-Aid Acid Test. New York: Farrar, Straus & Giroux, 1970.","Sims - True Stories",1970,"Wolfe","Tom","The Electric Kool-Aid Acid Test","Primary Works",TRUE
"269","Wolfe, Tom. The Kandy-Kolored Tangerine-Flake Streamline Baby. New York: Farrar, Straus & Giroux, 1965.","Sims - True Stories",1965,"Wolfe","Tom","The Kandy-Kolored Tangerine-Flake Streamline Baby","Primary Works",TRUE
"270","Wolfe, Tom. The Pump House Gang. New York: Farrar, Straus & Giroux, 1968.","Sims - True Stories",1968,"Wolfe","Tom","The Pump House Gang","Primary Works",TRUE
"271","Wolfe, Tom. The Right Stuff. New York: Farrar, Straus & Giroux, 1979.","Sims - True Stories",1979,"Wolfe","Tom","The Right Stuff","Primary Works",TRUE
"272","Wyckoff, Walter A. A Day with a Tramp, and Other Days. New York: Benjamin Blom Inc., 1971; originally published 1901.","Sims - True Stories",1901,"Wyckoff","Walter","A Day with a Tramp, and Other Days","Primary Works",TRUE
"273","Zinsser, William. Willie and Dwike: An American Profile. New York: Harper & Row, 1984.","Sims - True Stories",1984,"Zinsser","William","Willie and Dwike: An American Profile","Primary Works",TRUE
"274","An Experiment in Misery / Stephen Crane -- 1898","Kerrane and Yagoda - The Art of Fact",1898,"Crane","Stephen","An Experiment in Misery","Primary Works",TRUE
"275","Can't Get Their Minds Ashore / Abraham Cahan -- 1898 ","Kerrane and Yagoda - The Art of Fact",1898,"Cahan","Abraham","Can't Get Their Minds Ashore","Primary Works",TRUE
"276","Drift / Morris Markey -- 1931","Kerrane and Yagoda - The Art of Fact",1931,"Markey","Morris","Drift","Primary Works",TRUE
"277","from ""Harlem on My Mind"" / Lawrence Otis Graham -- 1993","Kerrane and Yagoda - The Art of Fact",1993,"Graham","Lawrence","""Harlem on My Mind""","Primary Works",TRUE
"278","from ""Portrait of Hemingway"" / Lillian Ross -- 1950","Kerrane and Yagoda - The Art of Fact",1950,"Ross","Lillian","""Portrait of Hemingway""","Primary Works",TRUE
"279","from ""Snake Handling and Redemption"" / Dennis Covington -- 1995","Kerrane and Yagoda - The Art of Fact",1995,"Covington","Dennis","""Snake Handling and Redemption""","Primary Works",TRUE
"280","from ""The Bronx Slave Market"" / Marvel Cooke -- 1950","Kerrane and Yagoda - The Art of Fact",1950,"Cooke","Marvel","""The Bronx Slave Market""","Primary Works",TRUE
"281","from ""The Scum Also Rises"" / Hunter S. Thompson -- 1971","Kerrane and Yagoda - The Art of Fact",1971,"Thompson","Hunter","""The Scum Also Rises""","Primary Works",TRUE
"282","from ""The Snap Revolution"" / James Fenton -- 1988","Kerrane and Yagoda - The Art of Fact",1988,"Fenton","James","""The Snap Revolution""","Primary Works",TRUE
"283","from Alive / Piers Paul Read -- 1974","Kerrane and Yagoda - The Art of Fact",1974,"Read","Piers","Alive","Primary Works",TRUE
"284","from Among the Thugs / Bill Buford --  1990","Kerrane and Yagoda - The Art of Fact",1990,"Buford","Bill","Among the Thugs","Primary Works",TRUE
"285","from Another Day of Life / Ryszard Kapuscinski -- 1976","Kerrane and Yagoda - The Art of Fact",1976,"Kapuscinski","Ryszard","Another Day of Life","Primary Works",TRUE
"286","from Black Lamb and Grey Falcon / Rebecca West -- 1941","Kerrane and Yagoda - The Art of Fact",1941,"West","Rebecca","Black Lamb and Grey Falcon","Primary Works",TRUE
"287","from Boys in Zinc / Svetlana Alexiyevich -- 1990","Kerrane and Yagoda - The Art of Fact",1990,"Alexiyevich","Svetlana","Boys in Zinc","Primary Works",TRUE
"288","from Brothers / Sylvester Monroe and Peter Goldman -- 1988","Kerrane and Yagoda - The Art of Fact",1988,"Goldman","Sylvester","Brothers","Primary Works",TRUE
"289","from Coyotes / Ted Conover -- 1987","Kerrane and Yagoda - The Art of Fact",1987,"Conover","Ted","Coyotes","Primary Works",TRUE
"290","from Dispatches / Michael Herr -- 1977","Kerrane and Yagoda - The Art of Fact",1977,"Herr","Michael","Dispatches","Primary Works",TRUE
"291","from Hiroshima / John Hersey -- 1946","Kerrane and Yagoda - The Art of Fact",1946,"Hersey","John","Hiroshima","Primary Works",TRUE
"292","from Homicide / David Simon -- 1991","Kerrane and Yagoda - The Art of Fact",1991,"Simon","David","Homicide","Primary Works",TRUE
"293","from House / Tracy Kidder -- 1985","Kerrane and Yagoda - The Art of Fact",1985,"Kidder","Tracy","House","Primary Works",TRUE
"294","from If Christ Came to Chicago / W.T. Stead -- 1894","Kerrane and Yagoda - The Art of Fact",1894,"Stead","W","If Christ Came to Chicago","Primary Works",TRUE
"295","from In Cold Blood / Truman Capole -- 1966","Kerrane and Yagoda - The Art of Fact",1966,"Capole","Truman","In Cold Blood","Primary Works",TRUE
"296","from Let Us Now Praise Famous Men / James Agee -- 1939","Kerrane and Yagoda - The Art of Fact",1939,"Agee","James","Let Us Now Praise Famous Men","Primary Works",TRUE
"297","from Ninety Times Guilty / Hickman Powell -- 1939","Kerrane and Yagoda - The Art of Fact",1939,"Powell","Hickman","Ninety Times Guilty","Primary Works",TRUE
"298","from Once There Was a War / John Steinbeck -- 1943","Kerrane and Yagoda - The Art of Fact",1943,"Steinbeck","John","Once There Was a War","Primary Works",TRUE
"299","from Specimen Days / Walt Whitman -- 1863","Kerrane and Yagoda - The Art of Fact",1863,"Whitman","Walt","Specimen Days","Primary Works",TRUE
"300","from The Armies of the Night / Norman Mailer -- 1968","Kerrane and Yagoda - The Art of Fact",1968,"Mailer","Norman","The Armies of the Night","Primary Works",TRUE
"301","from The Earl of Louisiana / A.J. Liebling -- 1961","Kerrane and Yagoda - The Art of Fact",1961,"Liebling","A","The Earl of Louisiana","Primary Works",TRUE
"302","from The Electric Kool-Aid Acid Test / Tom Wolfe -- 1968","Kerrane and Yagoda - The Art of Fact",1968,"Wolfe","Tom","The Electric Kool-Aid Acid Test","Primary Works",TRUE
"303","from The Life of Samuel Johnson / James Boswell -- 1791","Kerrane and Yagoda - The Art of Fact",1791,"Boswell","James","The Life of Samuel Johnson","Primary Works",TRUE
"304","from The People of the Abyss / Jack London -- 1902","Kerrane and Yagoda - The Art of Fact",1902,"London","Jack","The People of the Abyss","Primary Works",TRUE
"305","from The Pine Barrens / John Mcphee -- 1967","Kerrane and Yagoda - The Art of Fact",1967,"Mcphee","John","The Pine Barrens","Primary Works",TRUE
"306","from The True and Genuine Account of the Life and Actions of the Late Jonathan Wild / Daniel Defoe -- 1725","Kerrane and Yagoda - The Art of Fact",1725,"Defoe","Daniel","The True and Genuine Account of the Life and Actions of the Late Jonathan Wild","Primary Works",TRUE
"307","from What It Takes / Richard Ben Cramer -- 1992","Kerrane and Yagoda - The Art of Fact",1992,"Cramer","Richard","What It Takes","Primary Works",TRUE
"308","from Whoredom in Kimmage / Rosemary Mahoney -- 1993","Kerrane and Yagoda - The Art of Fact",1993,"Mahoney","Rosemary","Whoredom in Kimmage","Primary Works",TRUE
"309","Holiday Pageant: The Importance of Being Bluebell / Michael Winerip. -- 1987","Kerrane and Yagoda - The Art of Fact",1987,"Winerip","Michael","Holiday Pageant: The Importance of Being Bluebell","Primary Works",TRUE
"310","It's an Honor / Jimmy Breslin -- 1967","Kerrane and Yagoda - The Art of Fact",1967,"Breslin","Jimmy","It's an Honor","Primary Works",TRUE
"311","Japanese Earthquake / Ernest Hemingway -- 1923","Kerrane and Yagoda - The Art of Fact",1923,"Hemingway","Ernest","Japanese Earthquake","Primary Works",TRUE
"312","Juke Joint / Walter Bernstein -- 1945","Kerrane and Yagoda - The Art of Fact",1945,"Bernstein","Walter","Juke Joint","Primary Works",TRUE
"313","Lady Olga / Joseph Mitchell -- 1992","Kerrane and Yagoda - The Art of Fact",1992,"Mitchell","Joseph","Lady Olga","Primary Works",TRUE
"314","Lethal Lightning / Jimmy Cannon -- 1946","Kerrane and Yagoda - The Art of Fact",1946,"Cannon","Jimmy","Lethal Lightning","Primary Works",TRUE
"315","Los Angeles Notebook / Joan Didion -- 1968","Kerrane and Yagoda - The Art of Fact",1968,"Didion","Joan","Los Angeles Notebook","Primary Works",TRUE
"316","Marrakech / George Orwell -- 1953","Kerrane and Yagoda - The Art of Fact",1953,"Orwell","George","Marrakech","Primary Works",TRUE
"317","Pillelu, Pillelu! / Abraham Cahan -- 1899","Kerrane and Yagoda - The Art of Fact",1899,"Cahan","Abraham","Pillelu, Pillelu!","Primary Works",TRUE
"318","Shadow of a Nation / Gary Smith -- 1991","Kerrane and Yagoda - The Art of Fact",1991,"Smith","Gary","Shadow of a Nation","Primary Works",TRUE
"319","So ... We Meet at Last, Mr. Bond / Bob Greene -- 1991","Kerrane and Yagoda - The Art of Fact",1991,"Greene","Bob","So ... We Meet at Last, Mr. Bond","Primary Works",TRUE
"320","The Day of the Fight / W.C. Heinz -- 1947 ","Kerrane and Yagoda - The Art of Fact",1947,"Heinz","W","The Day of the Fight","Primary Works",TRUE
"321","The Death of Rodriguez / Richard Harding Davis -- 1903","Kerrane and Yagoda - The Art of Fact",1903,"Davis","Richard","The Death of Rodriguez","Primary Works",TRUE
"322","The Fight to Live / Al Stump -- 1994","Kerrane and Yagoda - The Art of Fact",1994,"Stump","Al","The Fight to Live","Primary Works",TRUE
"323","The Girl of the Year / Tom Wolfe -- 1964","Kerrane and Yagoda - The Art of Fact",1964,"Wolfe","Tom","The Girl of the Year","Primary Works",TRUE
"324","The Great Tasmania's Cargo / Charles Dickens -- 1860","Kerrane and Yagoda - The Art of Fact",1860,"Dickens","Charles","The Great Tasmania's Cargo","Primary Works",TRUE
"325","The Last Secrets of Skull and Bones / Ron Rosenbaum -- 1991","Kerrane and Yagoda - The Art of Fact",1991,"Rosenbaum","Ron","The Last Secrets of Skull and Bones","Primary Works",TRUE
"326","The Pig / Ben Hecht -- 1922","Kerrane and Yagoda - The Art of Fact",1922,"Hecht","Ben","The Pig","Primary Works",TRUE
"327","The Silent Season of a Hero / Gay Talese -- 1970","Kerrane and Yagoda - The Art of Fact",1970,"Talese","Gay","The Silent Season of a Hero","Primary Works",TRUE
"328","The Spike / George Orwell -- 1968","Kerrane and Yagoda - The Art of Fact",1968,"Orwell","George","The Spike","Primary Works",TRUE
"329","The Third Winter / Martha Gellhorn -- 1938","Kerrane and Yagoda - The Art of Fact",1938,"Gellhorn","Martha","The Third Winter","Primary Works",TRUE
"330","Tiananmen Square / John Simpson -- 1989 ","Kerrane and Yagoda - The Art of Fact",1989,"Simpson","John","Tiananmen Square","Primary Works",TRUE
"331","Two Generals / Norman Lewis -- 1958","Kerrane and Yagoda - The Art of Fact",1958,"Lewis","Norman","Two Generals","Primary Works",TRUE
"332","Watercress Girl / Henry Mayhew -- 1861","Kerrane and Yagoda - The Art of Fact",1861,"Mayhew","Henry","Watercress Girl","Primary Works",TRUE
"333","When Man Falls, a Crown Gathers / Stephen Crane -- 1894","Kerrane and Yagoda - The Art of Fact",1894,"Crane","Stephen","When Man Falls, a Crown Gathers","Primary Works",TRUE
"334","Abrahamson, David. “An Inconvenient Legacy: The Jungle and the Immigrant Imperative.” Journalism History 34 (Fall 2008): 163–65.","LJS Bibliography",2008,"Abrahamson","David","An Inconvenient Legacy: The Jungle and the Immigrant Imperative","Secondary Works",TRUE
"335","Alexander, Robert. “‘My Story Is Always Escaping Into other People’: Subjectivity, Objectivity, and the Double in American Literary Journalism.” Literary Journalism Studies 1, no. 1 (Spring 2009): 57–66.","LJS Bibliography",2009,"Alexander","Robert","‘My Story Is Always Escaping Into other People’: Subjectivity, Objectivity, and the Double in American Literary Journalism","Secondary Works",TRUE
"336","Anderson, Chris, ed. Literary Nonfiction: Theory, Criticism, Pedagogy. Carbondale, Ill.: Southern Illinois University Press, 1989.","LJS Bibliography",1989,"Anderson","Chris","Literary Nonfiction: Theory, Criticism, Pedagogy","Secondary Works",TRUE
"337","Anderson, Chris. Style as Argument: Contemporary American Nonfiction. Carbondale, Ill.: Southern Illinois University Press, 1987.","LJS Bibliography",1987,"Anderson","Chris","Style as Argument: Contemporary American Nonfiction","Secondary Works",TRUE
"338","Anonymous, Anonymous. “Chronicle and Comment.” The Bookman 14 (Oct. 1901): 110–11.","LJS Bibliography",1901,"Anonymous","Anonymous","Chronicle and Comment","Secondary Works",TRUE
"339","Anonymous, Anonymous. “Talking about Narrative Journalism.” Nieman Reports Fall 2000: 20–22.","LJS Bibliography",2000,"Anonymous","Anonymous","Talking about Narrative Journalism","Secondary Works",TRUE
"340","Anonymous, Anonymous. “The Point of View: The Newspaper and Fiction.” Scribner’s Magazine 40 (1906): 122–24.","LJS Bibliography",1906,"Anonymous","Anonymous","The Point of View: The Newspaper and Fiction","Secondary Works",TRUE
"341","Anonymous, Anonymous. Readership Institute. Impact Study. Media Management Center. Evanston, Ill.: Northwestern University, 2000. 15 April 2007 http://www.readership.org/resources/impact_study.htm","LJS Bibliography",2007,"Anonymous","Anonymous","Readership Institute","Secondary Works",TRUE
"342","Anonymous, Anonymous. Reportage preface. Proletarian Literature in the United States: An Anthology. Ed. Granville Hicks, et al. New York: International Publishers, 1935. 211–12.","LJS Bibliography",1935,"Anonymous","Anonymous","Reportage preface","Secondary Works",TRUE
"343","Applegate, Edd, ed. Literary Journalism: A Biographical Dictionary of Writers and Editors. Westport, Conn.: Greenwood Press, 1996.","LJS Bibliography",1996,"Applegate","Edd","Literary Journalism: A Biographical Dictionary of Writers and Editors","Secondary Works",TRUE
"344","Asch, Nathan. Review. The New Republic 4 Sept. 1935: 108.","LJS Bibliography",1935,"Asch","Nathan","Review","Secondary Works",TRUE
"345","Ashdown, Paul. “Ernest Hemingway.” A Sourcebook of American Literary Journalism: Representative Writers in an Emerging Genre. Ed. Thomas B. Connery. New York: Greenwood Press, 1992. 187–196.","LJS Bibliography",1992,"Ashdown","Paul","Ernest Hemingway","Secondary Works",TRUE
"346","Ashdown, Paul. “James Agee.” A Sourcebook of American Literary Journalism: Representative Writers in an Emerging Genre. Ed. Thomas B. Connery. New York: Greenwood Press, 1992. 197–204.","LJS Bibliography",1992,"Ashdown","Paul","James Agee","Secondary Works",TRUE
"347","Ball, John. Introduction. Children of the Levee by Lafcadio Hearn. Ed. O. W. Frost. [Lexington, Ky.:] University of Kentucky Press, 1957. 1–8.","LJS Bibliography",1957,"Ball","John","Introduction","Secondary Works",TRUE
"348","Banks, Anna. “Norman Mailer.” A Sourcebook of American Literary Journalism: Representative Writers in an Emerging Genre. Ed. Thomas B. Connery. New York: Greenwood Press, 1992. 297–306.","LJS Bibliography",1992,"Banks","Anna","Norman Mailer","Secondary Works",TRUE
"349","Bartley, Aryn. “The Citizen-Witness and the Politics of Shame: Walker Evans and James Agee’s Let Us Now Praise Famous Men.” Literary Journalism Studies 1, no. 2 (Fall 2009): 23–41.","LJS Bibliography",2009,"Bartley","Aryn","The Citizen-Witness and the Politics of Shame: Walker Evans and James Agee’s Let Us Now Praise Famous Men","Secondary Works",TRUE
"350","Bass, Sharon. “John McPhee.” A Sourcebook of American Literary Journalism: Representative Writers in an Emerging Genre. Ed. Thomas B. Connery. New York: Greenwood Press, 1992. 343–52.","LJS Bibliography",1992,"Bass","Sharon","John McPhee","Secondary Works",TRUE
"351","Berger, Arthur A. “Am I a Siamese Twin?” Journal of Popular Culture 9, no. 1 (Summer 1975): 162/64-67/69. 20th century; Tom Wolfe, Gay Talese; New Journalism; Magazines, newspapers; Popular culture.","LJS Bibliography",1975,"Berger","Arthur","Am I a Siamese Twin","Secondary Works",TRUE
"352","Berner, R. Thomas. “C. D. B. Bryan.” A Sourcebook of American Literary Journalism: Representative Writers in an Emerging Genre. Ed. Thomas B. Connery. New York: Greenwood Press, 1992. 317–22.","LJS Bibliography",1992,"Berner","R","C. D. B. Bryan","Secondary Works",TRUE
"353","Berner, R. Thomas. “Literary Notions and Utilitarian Reality.” Style 16 (Fall 1982): 452–57.","LJS Bibliography",1982,"Berner","R","Literary Notions and Utilitarian Reality","Secondary Works",TRUE
"354","Berner, R. Thomas. Literary Newswriting: The Death of an Oxymoron. Journalism Monographs 99. Columbia, S.C.: Association for Education in Journalism and Mass Communication, Oct. 1986.","LJS Bibliography",1986,"Berner","R","Thomas","Secondary Works",TRUE
"355","Berner, R. Thomas. The Literature of Journalism: Text and Context. State College, Penn.: Strata Publishing, Inc. 1999.","LJS Bibliography",1999,"Berner","R","Thomas","Secondary Works",TRUE
"356","Berner, R. Thomas. Writing Literary Features. Hillsdale, N.J.: Lawrence Erlbaum Associates, 1988.","LJS Bibliography",1988,"Berner","R","Thomas","Secondary Works",TRUE
"357","Beyer, Charlotte. “‘A Work and a Purpose’: Willa Cather’s Journalism.” The Journalistic Imagination: Literary Journalists from Defoe to Capote and Carter. Ed. Richard Keeble and Sharon Wheeler. London: Routledge, 2007. 74–86.","LJS Bibliography",2007,"Beyer","Charlotte","‘A Work and a Purpose’: Willa Cather’s Journalism","Secondary Works",TRUE
"358","Bordelon, Pamela, ed. Biographical essay. Go Gator and Muddy the Water: Writings by Zora Neale Hurston from the Federal Writers’ Project. New York: W. W. Norton, 1999.","LJS Bibliography",1999,"Bordelon","Pamela","Biographical essay","Secondary Works",TRUE
"359","Boylan, James. “Publicity for the Great Depression: Newspaper Default and Literary Reportage.” Mass Media Between the Wars: Perceptions of Cultural Tension, 1917–1941. Ed. Catherine Covert and John Stevens. Syracuse: Syracuse University Press, 1984. 159–79.","LJS Bibliography",1984,"Boylan","James","Publicity for the Great Depression: Newspaper Default and Literary Reportage","Secondary Works",TRUE
"360","Boylan, James. “The Long and Short of The Jungle.” Journalism History 34 (Fall 2008): 165–67.","LJS Bibliography",2008,"Boylan","James","The Long and Short of The Jungle","Secondary Works",TRUE
"361","Boynton, H. W. “The Literary Aspect of Journalism.” Atlantic 93 (1904): 845–51.","LJS Bibliography",1904,"Boynton","H","The Literary Aspect of Journalism","Secondary Works",TRUE
"362","Boynton, Robert S. The New New Journalism. New York: Vintage, 2005.","LJS Bibliography",2005,"Boynton","Robert","The New New Journalism","Secondary Works",TRUE
"363","Bradley, Patricia. “Richard Harding Davis.” A Sourcebook of American Literary Journalism: Representative Writers in an Emerging Genre. Ed. Thomas B. Connery. New York: Greenwood Press, 1992. 21–52.","LJS Bibliography",1992,"Bradley","Patricia","Richard Harding Davis","Secondary Works",TRUE
"364","Brady, John. “Nude Journalism.” Journal of Popular Culture 9, no. 1 (Summer 1975): 153/55-61/63. 20th century; Hugh Hefner; Magazine journalism; Magazines; Playboy.","LJS Bibliography",1975,"Brady","John","Nude Journalism","Secondary Works",TRUE
"365","Braman, Sandra. “Joan Didion.” A Sourcebook of American Literary Journalism: Representative Writers in an Emerging Genre. Ed. Thomas B. Connery. New York: Greenwood Press, 1992. 353–58.","LJS Bibliography",1992,"Braman","Sandra","Joan Didion","Secondary Works",TRUE
"366","Calvi, Pablo. “Latin America’s Own ‘New Journalism.’” Literary Journalism Studies 2, no. 2 (Fall 2010): 63–83.","LJS Bibliography",2010,"Calvi","Pablo","Latin America’s Own ‘New Journalism.","Secondary Works",TRUE
"367","Carey, John. Introduction. Ed. John Carey. The Faber Book of Reportage. London: Faber and Faber, 1987; rpt. as Eyewitness to History. New York: Avon, 1990. xxix–xxxviii.","LJS Bibliography",1990,"Carey","John","Introduction","Secondary Works",TRUE
"368","Carrillo, Maria. “Great Expectations: The Virginian-Pilot’s Commitment to Storytelling.” Points-of-Entry: Cross-Currents in Storytelling 2, no.1 (2004): 11–13.","LJS Bibliography",2004,"Carrillo","Maria","Great Expectations: The Virginian-Pilot’s Commitment to Storytelling","Secondary Works",TRUE
"369","Chance, Jean, and William McKeen. Introduction. Literary Journalism: A Reader. Ed. Jean Chance and William McKeen. Belmont, Calif.: Wadsworth, 2001. vii–xiv.","LJS Bibliography",2001,"Chance","Jean","Introduction","Secondary Works",TRUE
"370","Cheney, Theodore A. Rees. Writing Creative Nonfiction: Fiction Techniques for Crafting Great Nonfiction. Cincinnati: Ten Speed Press, 2000.","LJS Bibliography",2000,"Cheney","Theodore","Rees","Secondary Works",TRUE
"371","Clark, Roy Peter. “Tell Me a Story.” Poynter Online 12 December 2003.","LJS Bibliography",2003,"Clark","Roy","Tell Me a Story","Secondary Works",TRUE
"372","Connery, Thomas B. “A Third Way to Tell the Story: American Literary Journalism at the Turn of the Century.” Literary Journalism in the Twentieth Century. Ed. Norman Sims. Evanston, Ill.: Northwestern University Press, 2008. 3–20.","LJS Bibliography",2008,"Connery","Thomas","A Third Way to Tell the Story: American Literary Journalism at the Turn of the Century","Secondary Works",TRUE
"373","Connery, Thomas B. “Discovering a Literary Form.” A Sourcebook of American Literary Journalism: Representative Writers in an Emerging Genre. Ed. Thomas B. Connery. New York: Greenwood Press, 1992. 3–37.","LJS Bibliography",1992,"Connery","Thomas","Discovering a Literary Form","Secondary Works",TRUE
